input_text,target_text
The damage is done.,İş işten geçmiş.
The danger is over.,Tehlike bitti.
The demand is huge.,Talep çok büyük.
The disco is empty.,Disko boş.
The dog is barking.,Köpek havlıyor.
The dog is jumping.,Köpek zıplıyor.
The dog is panting.,Köpek hızlı hızlı soluyor.
The dog looks sick.,Köpek hasta gibi görünüyor.
The dog seems sick.,Köpek hasta görünüyor.
The dog wants meat.,Köpek et istiyor.
The dogs scared us.,Köpekler bizi korkuttu.
The door blew open.,Rüzgar kapıyı açtı.
The door blew shut.,Rüzgar kapıyı kapattı.
The door is closed.,Kapı kapalı.
The door is locked.,Kapı kilitlidir.
The doorknob broke.,Kapı kolu kırık.
The doors are open.,Kapılar açık.
The doors are shut.,Kapılar kapalı
The dress is green.,Elbise yeşildir.
The earth is round.,Dünya yuvarlak.
The economy is bad.,Ekonomi kötü.
The feud continues.,Kan davası devam ediyor.
The flame went out.,Alev söndü.
The floor gave way.,Zemin çöktü.
The floor is dirty.,Zemin kirli.
The floor is muddy.,Zemin çamurlu.
The floor is quiet.,Kat sessiz.
The floor was cold.,Zemin soğuktu.
The fog has lifted.,Sis kalktı.
The fruit went bad.,Meyve çürümüş.
The fuse has blown.,Sigorta atmış.
The game is rigged.,Oyun hileli.
The gap has closed.,Açıklık kapandı.
The gate is locked.,Kapı kilitli.
The gates are open.,Kapılar açık.
The girl is lonely.,Kız yalnız.
The glass is clean.,Bardak temiz.
The glass is dirty.,Bardak kirli.
The glass is empty.,Bardak boş.
The grass is dying.,Çim ölüyor.
The horse ran fast.,At hızlı koştu.
The house caved in.,Ev yıkıldı.
The house caved in.,Ev göçtü.
The house is clean.,Ev temiz.
The house is empty.,Ev boş.
The ice has melted.,Buz eridi.
The ice is melting.,Buz eriyor.
The idea isn't bad.,Fikir kötü değil.
The idea isn't new.,Düşünce yeni değil.
The job's not done.,İş yapılmış değil.
The king is coming.,Kral geliyor.
The knife is dirty.,Bıçak kirli.
The latrine stinks.,Tuvalet kokuyor.
The law is the law.,Kanun kanundur.
The light is green.,Işık yeşil.
The light is green.,Trafik ışığı yeşil.
The light went out.,Işık söndü.
The lights are out.,Işıklar söndü.
The line went dead.,Hat kesildi.
The lock is broken.,Kilit kırık.
The market rallied.,Piyasa yükseldi.
The match was over.,Maç bitti.
The meat is frozen.,Et dondurulmuş.
The meat was burnt.,Et yanmıştı.
The meat was burnt.,Et kavrulmuştu.
The men are coming.,Erkekler geliyor.
The men are hungry.,Erkekler açtırlar.
The men are hungry.,Erkekler aç.
The men go to work.,Erkekler işe giderler.
The milk went sour.,Süt ekşidi.
The moon is bright.,Ay parlak.
The movie was good.,Film iyiydi.
The night is young.,Gece genç.
The night was cold.,Gece soğuktu.
The night was cool.,Gece serindi.
The ocean is dirty.,Okyanus kirli.
The ocean was calm.,Okyanus sakindi.
The office is dark.,Ofis karanlık.
The old dog barked.,Yaşlı köpek havladı.
The paint's drying.,Boya kuruyor.
The pan is too hot.,Tava çok sıcak.
The paper is white.,Kağıt beyaz.
The park was empty.,Park boştu.
The parrot is dead.,Papağan öldü.
The party is today.,Parti bugün.
The party's Monday.,Parti pazartesi.
The path is direct.,Yol direkt.
The place is empty.,Yer boş.
The plane took off.,Uçak havalandı.
The plate is dirty.,Tabak kirli.
The power went out.,Elektrik kesildi.
The pressure is on.,Basınç açık.
The price is right.,Fiyat doğru.
The problem is Tom.,Sorun Tom.
The problem is his.,Sorun onun.
The problem is you.,Sorun sensin.
The race was fixed.,Yarışta rüşvet yoluyla hile yapıldı.
The rent was cheap.,Kira ucuzdu.
The results are in.,Sonuçlar içeride.
The road is closed.,Yol kapalı.
The road was clear.,Yol açıktı.
The rocket went up.,Roket yükseldi.
The room is a mess.,Oda karışık.
The room is stuffy.,Oda havasız.
The room was empty.,Oda boştu.
The room was quiet.,Oda sessizdi.
The score was even.,Skor eşitti.
The search is over.,Araştırma bitti.
The secret got out.,İşin sırrı çıktı.
The server is down.,"Sunucu, devre dışıdır."
The ship is at sea.,Gemi denizde.
The shirts are dry.,Gömlekler kuru.
The signal was red.,Sinyal kırmızıydı.
The skirt is green.,Etek yeşildir.
The sky brightened.,Gökyüzü aydınlandı.
The sky cleared up.,Gökyüzü açık.
The snow is melted.,Kar eridi.
The soldiers fired.,Askerler ateş etti.
The spider is dead.,Örümcek öldü.
The spoon is dirty.,Kaşık kirli.
The stamp came off.,Pul düştü.
The stars came out.,Yıldızlar çıktı.
The store's closed.,Mağaza kapalı.
The story wandered.,Hikaye yayıldı.
The story was true.,Hikaye gerçekti.
The summer is over.,Yaz bitti.
The sun is setting.,Güneş batıyor.
The sun is shining.,Güneş parlıyor.
The sun was bright.,Güneş parlaktı.
The table is green.,Masa yeşil.
The tank was empty.,Tank boştu.
The teenagers left.,Gençler gitti.
The telephone rang.,Telefon çaldı.
The tent collapsed.,Çadır çöktü.
The thief ran away.,Hırsız kaçtı.
The thief ran fast.,Hırsız hızlı koştu.
The thief ran fast.,Hırsız hızla kaçtı.
The thief vanished.,Hırsız kayıplara karıştı.
The threat is real.,Tehdit gerçek.
The tire leaks air.,Lastik hava sızdırıyor.
The tires squealed.,Lastikler cırladı.
The train is early.,Tren erken geldi.
The tree fell down.,Ağaç düştü.
The trial was fair.,Deneme adildi.
The wait continues.,Bekleme devam ediyor.
The water is clean.,Su temizdir.
The water was blue.,Su maviydi.
The water was cold.,Su soğuktu.
The water was warm.,Su sıcaktı.
The waves are high.,Dalgalar yüksek.
The wind blew hard.,Rüzgar sert esti.
The wind continued.,Rüzgar devam etti.
The wind died away.,Rüzgar kesildi.
The wind picked up.,Rüzgar güçlendi.
The window is here.,Pencere burada.
The window is open.,Pencere açık.
The winner was Tom.,Kazanan Tom'du.
The woman is naked.,Kadın çıplak.
The woman is ready.,Kadın hazır.
The women like tea.,Kadınlar çayı sever.
The wood is rotten.,Ahşap çürümüş.
The world is small.,Dünya küçük.
Their answer is no.,Onların cevabı hayır.
Their farms adjoin.,Onların çiftlikleri bitişik olur.
Their food ran out.,Onların yiyecekleri bitti.
Their logic was OK.,Onların mantığı iyiydi.
Then what happened?,Sonra ne oldu?
There are no rules.,Kurallar yoktur.
There are problems.,Sorunlar var.
There are traitors.,Hainler var.
There goes our bus.,Bizim otobüs gidiyor.
There is a problem.,Bir problem var.
There is no charge.,Hiçbir ücret yok.
There is no choice.,Hiçbir seçenek yoktur.
There is no escape.,Kaçış yoktur.
There is no escape.,Hiçbir kaçış yok.
There is one catch.,Dikkat edilmesi gereken bir şey var.
There is some wind.,Biraz rüzgar var.
There may be a way.,Bir yol olabilir.
There must be more.,Daha fazla olmalı.
There was a winner.,Bir kazanan vardı.
There was applause.,Alkış vardı.
There was no delay.,Hiç gecikme yoktu.
There was no hurry.,Acele yoktu.
There was no light.,Işık yoktu.
There was no music.,Müzik yoktu.
There was no sound.,Ses yoktu.
There were no jobs.,Hiç iş yoktu.
There you go again.,İşte yine başlıyoruz.
There're no lights.,Hiç ışık yok.
There's a big hole.,Büyük bir çukur var.
There's a big sign.,Büyük bir işaret var.
There's a bus here.,Burada bir otobüs var.
There's a day left.,Bir gün kaldı.
There's a gas leak.,Gaz kaçağı var.
There's no mistake.,Hata yok.
There's no problem.,Hiçbir sorun yok.
There's no urgency.,Hiçbir aciliyet yok.
There's no way out.,Hiçbir çıkış yolu yok.
There's one chance.,Bir şans var.
There's still hope.,Hâlâ umut var.
There's still time.,Hâlâ zaman var.
There's the answer.,Cevap var.
There's the doctor.,Doktor var.
There's work to do.,Yapılacak iş var.
There's your proof.,Kanıtın var.
These are from Tom.,Bunlar Tom'dan.
These are gorgeous.,Bunlar muhteşem.
These are his pens.,Bunlar onun kalemleri.
These are my books.,Bunlar benim kitaplarım.
These are my pants.,Bunlar benim pantolonum.
These are my terms.,Bunlar benim şartlarım.
These are our kids.,Bunlar bizim çocuklarımız.
These aren't cheap.,Bunlar ucuz değiller.
These belong to me.,Bunlar bana ait.
These came for you.,Bunlar senin için geldi.
These cars are big.,Bu arabalar büyük.
These dogs are big.,Bu köpekler büyük.
These must be fake.,Bunlar sahte olmalı.
These pens are his.,Bu kalemler onun.
They abandoned Tom.,Onlar Tom'u terk ettiler.
They abandoned you.,Onlar seni terk ettiler.
They adopted a kid.,Onlar bir çocuğu evlet edindi.
They all applauded.,Onların hepsi alkışladı.
They all can drive.,Onların hepsi araba sürebilir.
They all did great.,Onların hepsi harika yaptı.
They all have come.,Onların hepsi geldi.
They all have kids.,Onların hepsinin çocukları var.
They all know this.,Onların hepsi bunu biliyor.
They all looked up.,Onların hepsi gözlerini yukarı dikti.
They all loved Tom.,Onların hepsi Tom'u sevdi.
They all went back.,Onların hepsi geri gitti.
They almost got us.,Onlar neredeyse bizi yakaladılar.
They approached us.,Onlar bize yaklaştı.
They are all alike.,Bunların hepsi birbirine benziyor.
They are all happy.,Onların hepsi mutlu.
They are both good.,Onların her ikisi de iyidir.
They are exhausted.,Onlar çok yorgun.
They are impatient.,Onlar sabırsız.
They are neighbors.,Onlar komşular.
They are not tired.,Onlar yorgun değil.
They are outsiders.,Onlar yabancı.
They are too close.,Onlar çok yakın.
They are very kind.,Onlar çok nazik.
They are wrestlers.,Onlar güreşçiler.
They aren't hungry.,Aç değiller.
They aren't stupid.,Onlar aptal değiller.
They asked me back.,Beni geri istediler.
They beat us badly.,Onlar bizi kötü yendi.
They became silent.,Onlar sessiz oldu.
They began to kiss.,Onlar öpüşmeye başladı.
They began to move.,Onlar hareket etmeye başladı.
They believed that.,Onlar ona inanıyordu.
They believed that.,Buna inanıyorlardı.
They both chuckled.,Onların ikisi de kıkırdadılar.
They both did well.,İkisi de iyi yaptı.
They both got rich.,İkisi de zengin oldu.
They both sat down.,Her ikisi de oturdu.
They both screamed.,Onların ikisi de çığlık attı.
They came together.,Onlar birlikte geldiler.
They can afford it.,Bunu göze alabilirler.
They can all shoot.,Hepsi ateş edebilirler.
They can handle it.,Onlar onu elleyebilirler.
They can't do that.,Onu yapamazlar.
They can't do this.,Onlar bunu yapamaz.
They can't fire me.,Onlar beni kovamaz.
They can't get out.,Onlar dışarıya çıkamaz.
They can't hurt me.,Onlar beni incitemezler.
They can't kill us.,Onlar bizi öldüremezler.
They can't see Tom.,Onlar Tom'u göremiyor.
They can't see you.,Onlar seni göremezler.
They can't stop it.,Onlar onu durduramaz.
They can't stop me.,Onlar beni durduramaz.
They can't stop us.,Onlar bizi durduramaz.
They cost too much.,Onlar çok pahalıya mal oldu.
They couldn't talk.,Onlar konuşamadı.
They crept forward.,Onlar ileriye doğru süründü.
They did it anyway.,Onlar onu yine de yaptı.
They did mean that.,Onlar onu demek istedi.
They did not enter.,Onlar girmedi.
They did very well.,Çok iyi yaptılar.
They didn't answer.,Onlar cevap vermediler.
They didn't listen.,Onlar dinlemedi.
They didn't pay me.,Onlar bana ödeme yapmadı.
They didn't see it.,Onlar onu görmediler.
They didn't see me.,Beni görmediler.
They didn't see us.,Onlar bizi görmediler.
They dine at seven.,Onlar yedide yemek yerler.
They don't know me.,Onlar beni tanımıyorlar.
They don't know us.,Onlar bizi tanımazlar.
They don't like me.,Onlar beni sevmezler.
They don't like us.,Onlar bizden hoşlanmıyorlar.
They don't need us.,Onların bize ihtiyacı yok.
They don't sell it.,Onlar onu satmaz.
They don't want it.,Onlar bunu istemiyor.
They don't want us.,Onlar bizi istemiyor.
They eat chocolate.,Onlar çikolata yerler.
They expect to win.,Onlar kazanmayı umuyor.
They finished 13th.,Onlar 13'üncü tamamladılar.
They found nothing.,Onlar bir şey bulmadılar.
They gave it to me.,Onlar onu bana verdi.
They got a big one.,Onlar büyük bir tane aldılar.
They got the prize.,Onlar ödül aldı.
They had a meeting.,Onların bir toplantısı vardı.
They had a mission.,Onların bir görevi vardı.
They had a problem.,Onların bir sorunu vardı.
They had no chance.,Onların şansı yoktu.
They had no rights.,Onların hiç bir hakkı yoktu.
They had no rights.,Onların hakları yoktu.
They hardly paused.,Onlar neredeyse hiç duraklamadı.
They hate our guts.,Onlar bizden tiksiniyor.
They have declined.,Onlar reddetti.
They have families.,Aileleri var.
They have hostages.,Onların rehineleri var.
They have no money.,Onların paraları yok.
They heard gunfire.,Onlar silah sesi duydular.
They kept drinking.,İçmeye devam ettiler.
They know about it.,Onlar onun hakkında biliyor.
They know who I am.,Kim olduğumu bilirler.
They laughed again.,Tekrar güldüler.
They laughed at me.,Onlar bana güldü.
They laughed at me.,Bana güldüler.
They laughed at us.,Bize güldüler.
They left me alone.,Beni yalnız bıraktılar.
They left together.,Birlikte gittiler.
They like the idea.,Onlar fikri sevdi.
They like to dance.,Onlar dans etmeyi seviyorlar.
They live in caves.,Onlar mağaralarda yaşıyor.
They live in peace.,Onlar barış içinde yaşarlar.
They live in tents.,Onlar çadırlarda yaşıyor.
They look American.,Onlar Amerikalı görünüyor.
They look confused.,Onlar şaşkın görünüyorlar.
They look familiar.,Onlar tanıdık görünüyorlar.
They look relieved.,Onlar rahatlamış görünüyor.
They look smashing.,Onlar müthiş görünüyorlar.
They look so happy.,Çok mutlu görünüyorlar.
They looked around.,Etraflarına bakındılar.
They made him work.,Onlar onu çalıştırdılar.
They made me do it.,Onu bana yaptırdılar.
They made the goal.,Onlar amacını gerçekleştirdi.
They make me laugh.,Onlar beni güldürüyorlar.
They may come back.,Onlar geri gelebilir.
They may need help.,Onların yardıma ihtiyacı olabilir.
They mean business.,Onlar iş anlamına geliyorlar.
They met in prison.,Onlar hapishanede tanıştılar.
They met in secret.,Onlar gizli bir yerde buluştu.
They might hear us.,Onlar bizi işitebilir.
They must be happy.,Onlar mutlu olmalılar.
They must love you.,Seni sevmeliler.
They need a doctor.,Onların bir doktora ihtiyacı var.
They need a doctor.,Onlara bir doktor lazım.
They need our help.,Yardımımıza ihtiyaçları var.
They need to study.,Onların çalışması gerek.
They never existed.,Onlar asla var olmadılar.
They never gave up.,Onlar asla vazgeçmedi.
They never give up.,Onlar asla vazgeçmez.
They never said no.,Onlar asla hayır demedi.
They never stopped.,Onlar asla durmadılar.
They obeyed orders.,Onlar emirlere itaat ettiler.
They only want Tom.,Onlar sadece Tom'u istiyor.
They peered inside.,İçeriye dikkatle baktılar.
They read her book.,Onlar onun kitabını okur.
They really did it.,Bunu gerçekten onlar yaptı.
They really did it.,Gerçekten bunu yaptılar.
They say he's sick.,Onun hasta olduğunu söylüyorlar.
They seem American.,Onlar Amerikalı görünüyor.
They seem so happy.,Onlar çok mutlu görünüyor.
They should pay me.,Onlar bana ödeme yapmalılar.
They should pay me.,Onlar bana para vermeliler.
They should use it.,Onlar onu kullanmalı.
They smiled at Tom.,Onlar Tom'a gülümsediler.
They smiled at you.,Onlar sana gülümsedi.
They spoke briefly.,Kısaca konuştular.
They spoke quietly.,Onlar sessizce konuştular.
They stared at Tom.,Onlar Tom'a baktılar.
They still want it.,Onlar hala onu istiyorlar.
They stuck with me.,Onlar benimle kaldı.
They talk too much.,Onlar çok fazla konuşur.
They took Tom away.,Tom'u götürdüler.
They turned around.,Onlar etrafında döndüler.
They understand us.,Onlar bizi anlar.
They voted Tom out.,Onlar Tom'un aleyhinde oy verdi.
They walk too slow.,Onlar çok yavaş yürür.
They walked around.,Onlar etrafta yürüdüler.
They walked inside.,Onlar içeride yürüdüler.
They want Tom back.,Onlar Tom'u geri istiyorlar.
They want our help.,Yardımımızı istiyorlar.
They want the best.,Onlar en iyisini istiyor.
They want to fight.,Onlar dövüşmek istiyor.
They want you back.,Onlar seni geri istiyorlar.
They want you dead.,Onlar seni ölü istiyor.
They went shopping.,Onlar alışverişe gitti.
They went to a bar.,Onlar bir bara gittiler.
They went together.,Onlar birlikte gittiler.
They went upstairs.,Onlar yukarı gitti.
They were all busy.,Onların hepsi meşguldü.
They were all here.,Onların hepsi buradaydı.
They were all weak.,Onların hepsi zayıftı.
They were ambushed.,Onlar pusuya düşmüştü.
They were attacked.,Onlara saldırıldı.
They were barefoot.,Onlar yalınayaktı.
They were cheerful.,Onlar neşeliydi.
They were confused.,Onlar şaşkındı.
They were fearless.,Onlar korkusuzdu.
They were fighting.,Onlar dövüşüyordu.
They were grateful.,Onlar minnettardı.
They were laughing.,Onlar gülüyordu.
They were murdered.,Onlar öldürüldü.
They were outraged.,Onlar çok öfkeliydi.
They were peaceful.,Onlar barışseverdi.
They were reckless.,Onlar pervasızdı.
They were servants.,Onlar hizmetçiydi.
They were sleeping.,Onlar uyuyordu.
They were sleeping.,Onlar uyuyorlardı.
They were so heavy.,Onlar çok ağırdı.
They were so young.,Onlar çok gençti.
They were soldiers.,Onlar askerdiler.
They were swimming.,Onlar yüzüyorlardı.
They were thrilled.,Onlar heyecanlıydı.
They were together.,Onlar birlikteydiler.
They were tortured.,Onlara işkence edildi.
They were tortured.,Onlar işkence gördüler.
They were traitors.,Onlar vatan hainleriydiler.
They weren't drunk.,Onlar sarhoş değildi.
They weren't there.,Onlar orada değillerdi.
They will not pass!,Onlar geçmeyecek!
They won that game.,Onlar o oyunu kazandı.
They won the match.,Maçı kazandılar!
They won't be back.,Onlar geri gelmeyecekler.
They won't be shot.,Onlar vurulmayacak.
They won't come in.,Onlar içeri gelmeyecekler.
They won't do that.,Onlar onu yapmayacaklar.
They won't find it.,Onlar onu bulmayacak.
They won't fire me.,Onlar beni kovmayacak.
They won't get far.,Onlar yol katetmeyecekler.
They won't help us.,Onlar bize yardım etmeyecekler.
They won't hurt us.,Onlar bizi incitmeyecekler.
They won't like me.,Beni sevmeyecekler.
They won't make it.,Onu yapmayacaklar.
They won't tell us.,Bize söylemeyecekler.
They work at night.,Onlar gece çalışırlar.
They work together.,Onlar birlikte çalışırlar.
They work too much.,Onlar çok fazla çalışırlar.
They wouldn't stop.,Onlar durmadı.
They'll be pleased.,Onlar memnun olacaklar.
They'll be waiting.,Onlar bekliyor olacaklar.
They'll come to us.,Onlar bize gelecekler.
They'll get caught.,Onlar yakalanacak.
They'll never know.,Onlar asla bilmeyecek.
They'll suspect me.,Benden kuşkulanacaklar.
They'll understand.,Onlar anlayacak.
They're Christians.,Onlar Hristiyan.
They're all guilty.,Onların hepsi suçlu.
They're all hungry.,Hepsi aç.
They're all hungry.,Hepsinin karnı aç.
They're all normal.,Onların hepsi normal.
They're all strong.,Onların hepsi güçlü.
They're both alive.,Onların her ikisi de hayatta.
They're both awful.,Onların ikisi de berbat.
They're both crazy.,Onların her ikisi de deli.
They're both drunk.,Onların her ikisi de sarhoş.
They're both empty.,Onların her ikisi de boş.
They're both quiet.,Onların her ikisi de sessiz.
They're both right.,Onların her ikisi de haklı.
They're both wrong.,Onların her ikisi de yanılıyor.
They're carnations.,Onlar karanfiller.
They're coming now.,Şimdi geliyorlar.
They're doing fine.,Onlar iyiler.
They're downstairs.,Onlar alt kattalar.
They're foreigners.,Onlar yabancı.
They're free to go.,Onlar gitmekte özgürler.
They're good folks.,Onlar iyi milletler.
They're great kids.,Onlar harika çocuklar.
They're handcuffed.,Onlar kelepçeliler.
They're having fun.,Onlar eğleniyorlar.
They're in the car.,Onlar arabadalar.
They're in trouble.,Onların başı belada.
They're incredible.,Onlar inanılmaz.
They're interested.,Onlar ilgili.
They're just human.,Onlar sadece insan.
They're just words.,Onlar sadece kelimeler.
They're leaving us.,Onlar bizi terk ediyorlar.
They're mad at you.,Onlar sana kızgın.
They're miles away.,Onlar millerce uzakta.
They're moving out.,Onlar taşınıyorlar.
They're my cousins.,Onlar benim kuzenlerim.
They're my friends.,Onlar benim arkadaşlarım.
They're not afraid.,Onlar korkmuyorlar.
They're not coming.,Onlar gelmiyorlar.
They're not freaks.,Onlar kaçık değil.
They're not hungry.,Aç değiller.
They're not hungry.,Karınları aç değil.
They're not idiots.,Onlar aptal değil.
They're not moving.,Onlar hareket etmiyorlar.
They're not moving.,Onlar taşınmıyorlar.
They're not so bad.,Çok kötü değiller.
They're not stupid.,Onlar aptal değil.
They're only ideas.,Onlar sadece fikirlerdir.
They're our heroes.,Onlar bizim kahramanlarımız.
They're part of us.,Onlar parçamız.
They're pretty new.,Onlar oldukça yeni.
They're quite safe.,Onlar oldukça güvenli.
They're really big.,Onlar gerçekten büyük.
They're relentless.,Onlar acımasızlar.
They're speechless.,Onlar sessizler.
They're still here.,Onlar hâlâ burada.
They're still here.,Hâlâ buradalar.
They're the police.,Onlar polis.
They're tough guys.,Onlar sert insanlar.
They're tough kids.,Onlar sert çocuklar.
They're unemployed.,Onlar işsizler.
They're unreliable.,Onlar güvenilmez.
They're very close.,Onlar çok samimi.
They're very happy.,Onlar çok mutlu.
They're very smart.,Onlar çok zeki.
They're very tense.,Onlar çok gergin.
"They're yours, Tom.","Onlar seninki, Tom."
They've caught Tom.,Onlar Tom'u yakaladılar.
They've fooled you.,Seni aptal yerine koydular.
They've had a talk.,Onlar bir konuşma yaptı.
They've had enough.,Onların yeterince vardı.
They've spotted us.,Onlar bizi fark ettiler.
Things are quieter.,İşler daha sakin.
Things are serious.,İşler ciddi.
Things aren't easy.,İşler kolay değil.
Things come and go.,İşler gelip gidiyor.
Things got serious.,Şeyler ciddi bir hal aldı.
Things got strange.,Şeyler tuhaf oldu.
Things got violent.,İşler şiddetlendi.
"Think about it, OK?","Bunun hakkında düşün, tamam mı?"
Think for a moment.,Bir an için düşün.
Think for yourself.,Kendin için düşün.
This I have to see.,Bunu görmek zorundayım.
This bag is greasy.,Bu çanta yağlı.
This belongs to me.,Bu bana ait.
This book is Tom's.,Bu kitap Tom'un.
This book is heavy.,Bu kitap ağır.
This book is small.,Bu kitap küçük.
This book is yours.,Bu kitap sizinki.
This book was easy.,Bu kitap kolaydı.
This boy is my son.,Bu çocuk benim oğlum.
This cake is sweet.,Bu pasta tatlı.
This can't be good.,Bu iyi olamaz.
This can't be real.,Bu gerçek olamaz.
This can't be true.,Bu doğru olamaz.
This chair is ugly.,Bu sandalye tehlikeli.
This clock is mine.,Bu saat benim.
This coat fits you.,Bu ceket sana uyar.
This corn is fresh.,Bu mısır taze.
This costs nothing.,Bunun hiçbir maliyeti yok.
This costs nothing.,Bu beleş.
This could be huge.,Bu kötüleşebilir.
This dish is tasty.,Bu yemek lezzetli.
This doesn't count.,Bu saymıyor.
This dog runs fast.,Bu köpek hızlı koşar.
This door's locked.,Bu kapı kilitli.
This feels amazing.,Bu inanılmaz hissettiriyor.
This fight is mine.,Bu dövüş benim.
This fork is dirty.,Bu çatal kirli.
This game is fixed.,Bu oyun hilelidir.
This has been good.,Bu iyiydi.
This hat isn't new.,Bu şapka yeni değil.
This house is mine.,Bu ev benimdir.
This is Ali's book.,"Bu, Ali'nin kitabı."
This is Mary's dog.,Bu Mary'nin köpeği.
This is Tom's book.,Bu Tom'un kitabı.
This is Tom's dish.,Bu Tom'un yemeği.
This is Tom's room.,"Bu, Tom'un odası."
This is Tom's turf.,Burası Tom'un mıntıkası.
This is Tom's turf.,Burası Tom'un çöplüğü.
This is Tom's turf.,Burası Tom'un bölgesi.
This is a bad deal.,Bu kötü bir anlaşma.
This is a bad idea.,Bu kötü bir fikir.
This is a bad plan.,Bu kötü bir plan.
This is a bad sign.,Bu kötü bir işaret.
This is a bad time.,Bu kötü bir zaman.
This is a big deal.,Bu büyük bir anlaşma.
This is a big help.,Bu büyük bir yardım.
This is a bus stop.,Bu bir otobüs durağı.
This is a computer.,Bu bir bilgisayar.
This is a disaster.,Bu bir felaket.
This is a disgrace.,Bu bir rezalet.
This is a fun date.,Bu eğlenceli bir tarihtir.
This is a good car.,Bu iyi bir araba.
This is a good job.,Bu güzel bir iş.
This is a hard job.,Bu zor bir iş.
This is a new idea.,Bu yeni bir fikir.
This is a painting.,Bu bir resim.
This is a road map.,Bu bir yol haritası.
This is a surprise.,Bu bir sürpriz.
This is a triangle.,Bu bir üçgen.
This is acceptable.,Bu kabul edilebilir.
This is all I have.,Tüm sahip olduğum budur.
This is all I know.,Bütün bildiğim budur.
This is all I need.,Tüm ihtiyacım olan bu.
This is all I want.,Tüm istediğim bu.
This is all stupid.,Bunun hepsi aptalca.
This is an anomaly.,Bu bir anomali.
This is an extract.,Bu bir özüt.
This is astounding.,Bu şaşırtıcı.
This is between us.,Bu bizim aramızda.
This is classified.,Bu sınıflandırılmış.
This is depressing.,Bu iç karartıcı.
This is disgusting.,Bu iğrenç.
This is disturbing.,Bu rahatsız edici.
This is everything.,Bu her şeydir.
This is good sushi.,Bu iyi suşi.
This is great news.,Bu harika bir haber.
This is harassment.,"Bu, rahatsızlık."
This is hysterical.,Bu isterik.
This is impossible.,Bu mümkün değil.
This is incredible.,Bu inanılmaz.
This is intriguing.,Bu ilgi çekici.
This is irrelevant.,Bu ilgisiz.
This is just awful.,Bu tam anlamıyla korkunç.
This is just crazy.,Bu tam çılgın.
This is just water.,Bu sadece su.
This is just wrong.,Bu sadece yanlış.
This is killing me.,Bu beni öldürüyor.
This is like magic.,Bu sihir gibidir.
This is much worse.,Bu çok daha kötü.
This is my bedroom.,Bu benim yatak odam.
This is my bicycle.,Bu benim bisikletim.
This is my brother.,Bu benim erkek kardeşim.
