input_text,target_text
It was Tom's fault.,O Tom'un hatasıydı.
It was a bad movie.,Bu kötü bir filmdi.
It was a big night.,Bu büyük bir geceydi.
It was a challenge.,O bir meydan okumaydı.
It was a fair game.,O adil bir oyundu.
It was a fun night.,Eğlenceli bir geceydi.
It was a good call.,O iyi bir konuşmaydı.
It was a good call.,İyi fikirdi.
It was a good game.,O iyi bir oyundu.
It was a good idea.,İyi bir fikirdi.
It was a good plan.,O iyi bir plandı.
It was a good race.,O iyi bir yarıştı.
It was a good show.,O iyi bir gösteriydi.
It was a good trip.,Güzel bir geziydi.
It was a great day.,O harika bir gündü.
It was a hard exam.,Zor bir sınavdı.
It was a hot night.,Sıcak bir geceydi.
It was a huge deal.,Bu büyük bir anlaşmaydı.
It was a long wait.,O uzun bir bekleyişti.
It was a lucky win.,O şanslı bir kazançtı.
It was a near miss.,Ramak kalmıştı.
It was a nice idea.,Bu güzel bir fikirdi.
It was a nice race.,O güzel bir yarıştı.
It was a nightmare.,O bir kabustu.
It was a nightmare.,Tam bir felaketti.
It was a nightmare.,O bir kâbustu.
It was a rainy day.,Yağmurlu bir gündü.
It was a rough day.,Zor bir gündü.
It was a sad story.,O üzücü bir hikayeydi.
It was a tough day.,Zor bir gündü.
It was a tradition.,O bir gelenekti.
It was about money.,"O, para hakkındaydı."
It was all a dream.,Hepsi bir rüyaydı.
It was all a farce.,Hepsi bir saçmalıktı.
It was all a trick.,Bunun hepsi bir hileydi.
It was all my idea.,O tamamen benim fikrimdi.
It was all planned.,Bunun hepsi planlandı.
It was all so easy.,Hepsi çok kolaydı.
It was an accident.,O bir kazaydı.
It was astonishing.,O şaşırtıcıydı.
It was competitive.,O rekabetçiydi.
It was complicated.,Bu karmaşıktı.
It was disgraceful.,Utanç vericiydi.
It was done before.,Daha önce yapıldı.
It was easy to fix.,Bunu tamir etmek kolaydı.
It was fascinating.,O büyüleyiciydi.
It was frightening.,O korkutucuydu.
It was frustrating.,Bu sinir bozucuydu.
It was given to me.,O bana verildi.
It was good enough.,O yeterince iyiydi.
It was handcrafted.,O bir el yapımıydı.
It was hot and dry.,Sıcak ve kuraktı.
It was hot outside.,Hava dışarıda sıcaktı.
It was humiliating.,O küçültücüydü.
It was humiliating.,O aşağılayıcıydı.
It was in this box.,O bu kutudaydı.
It was interesting.,İlginçti.
It was just a joke.,O sadece bir şakaydı.
It was just a joke.,Sadece bir şakaydı.
It was just a kiss.,Sadece bir öpücüktü.
It was just a wish.,Sadece bir dilekti.
It was just nerves.,Bu sadece cesaretti.
It was just stupid.,Bu sadece aptalcaydı.
It was lots of fun.,O çok eğlenceliydi.
It was magnificent.,O muhteşemdi.
It was mesmerizing.,O büyüleyiciydi.
It was my decision.,O benim kararımdı.
It was my pleasure.,Benim için bir zevkti.
It was my suitcase.,Bu benim valizimdi.
It was nearly noon.,Neredeyse öğle idi.
It was no accident.,Bu bir kaza değildi.
It was no big deal.,Önemli bir şey değildi.
It was no big deal.,Abartmaya değmezdi.
It was on the list.,"Bu, listedeydi."
It was on the news.,Haberlerdeydi.
It was outstanding.,Olağanüstüydü.
It was pitch-black.,Zifiri karanlıktı.
It was poor timing.,O kötü zamanlamaydı.
It was predictable.,Bu öngörülebilirdi.
It was pretty cool.,Hava oldukça serindi.
It was pretty dark.,Oldukça karanlıktı.
It was pretty easy.,O gerçekten kolaydı.
It was pretty good.,O oldukça iyiydi.
It was pretty gory.,O oldukça korkunçtu.
It was pretty hard.,O oldukça zordu.
It was pretty huge.,O oldukça büyüktü.
It was pretty loud.,O oldukça yüksek sesliydi.
It was preventable.,O önlenebilirdi.
It was quiet again.,Tekrar sessizdi.
It was quite funny.,O oldukça komikti.
It was quite windy.,Oldukça rüzgarlıydı.
It was really cold.,Hava gerçekten çok soğuktu.
It was really cool.,O gerçekten güzeldi.
It was really cute.,O gerçekten sevimliydi.
It was really dark.,Gerçekten karanlıktı.
It was really easy.,O gerçekten kolaydı.
It was really good.,O gerçekten iyiydi.
It was really hard.,Gerçekten zordu.
It was really neat.,Bu gerçekten temizdi.
It was really nice.,O gerçekten güzeldi.
It was really ugly.,O gerçekten çirkindi.
It was rough today.,O bugün kabaydı.
It was sensational.,O sansasyoneldi.
It was six o'clock.,Saat altıydı.
It was so fabulous.,O çok harikaydı.
It was so horrible.,O çok korkunçtu.
It was so much fun.,O çok eğlenceliydi.
It was so mystical.,O çok gizemliydi.
It was so romantic.,O çok romantikti.
It was so terrible.,O çok korkunçtu.
It was so terrific.,O çok müthişti.
It was sort of fun.,O biraz eğlenceliydi.
It was spectacular.,O muhteşemdi.
It was still there.,O hâlâ oradaydı.
It was superficial.,O yüzeyseldi.
It was that simple.,Bu o kadar basitti.
It was their fault.,Bu onların hatasıydı.
It was too extreme.,O çok aşırıydı.
It was too intense.,O çok yoğundu.
It was unavoidable.,Kaçınılmazdı.
It was unfortunate.,Talihsizdi.
It was unthinkable.,O düşünülemezdi.
It was very simple.,Çok kolaydı.
It was very stuffy.,O çok tıkalıydı.
It was very unreal.,Bu çok gerçek dışıydı.
It was worse today.,Bugün daha kötüydü.
It was worth a try.,O denemeye değerdi.
It was your choice.,Bu senin seçimindi.
It wasn't a threat.,Bu bir tehdit değildi.
It wasn't my fault.,"O, benim hatam değildi."
It wasn't my fault.,Benim hatam değildi.
It wasn't personal.,Kişisel değildi.
It wasn't possible.,Bu mümkün değildi.
It wasn't relevant.,Bu ilgili değildi.
It wasn't that bad.,O kadar kötü değildi.
It wasn't that big.,O bu kadar büyük değildi.
It wasn't upstairs.,O üst kat değildi.
It wasn't very fun.,O çok eğlenceli değildi.
It won't be enough.,O yeterli olmayacak.
It won't be so bad.,Bu çok kötü olmayacak.
It won't last long.,Uzun sürmeyecek.
It won't take long.,Uzun sürmez.
It worked at first.,O başta çalıştı.
It worked out well.,O iyi işe yaradı.
It works just fine.,O sadece iyi çalışır.
It works perfectly.,O mükemmel çalışır.
It wouldn't matter.,Önemli olmadı.
It'd be a disaster.,Bu bir felaket olurdu.
It'll be a big day.,Büyük bir gün olacak.
It'll be all right.,Bu iyi olacak.
It'll be beautiful.,Güzel olacak.
It'll be dangerous.,Tehlikeli olacak.
It'll be dark soon.,Yakında karanlık olacak.
It'll be different.,Bu farklı olacak.
It'll be difficult.,Zor olacak.
It'll be expensive.,Pahalı olacak.
It'll be hilarious.,Gülünç olacak.
It'll be invisible.,Bu görünmez olacak.
It'll be over soon.,O yakında bitecek.
It'll be safe here.,Burada güvende olunacak.
It'll be very hard.,Bu çok zor olacak.
It'll be wonderful.,Harika olacak.
It'll be worthless.,Bu değersiz olacak.
It'll happen again.,Tekrar olacak.
It'll have to wait.,Bunun beklemesi gerekecek.
It'll never change.,Bu asla değişmeyecek.
It'll never happen.,Asla olmayacak.
It'll rain tonight.,Bu gece yağmur yağacak.
It'll soon be dark.,Yakında karanlık olacak.
It's Tom's profile.,"O, Tom'un profili."
"It's Tom, isn't it?","O, Tom, değil mi?"
"It's Tom, isn't it?","Bu Tom, değil mi?"
It's a Cuban cigar.,O bir Küba purosudur.
It's a French word.,Bu Fransızca bir kelime.
It's a bad disease.,Bu kötü bir hastalık.
It's a bad example.,Bu kötü bir örnek.
It's a bad problem.,Bu kötü bir sorun.
It's a big company.,O büyük bir şirkettir.
It's a big concern.,Bu büyük bir ilgi.
It's a big country.,Bu büyük bir ülke.
It's a big problem.,O büyük bir sorun.
It's a bit awkward.,Bu biraz tuhaf.
It's a bit extreme.,Bu biraz aşırıdır.
It's a catchy song.,O akılda kalıcı bir şarkı.
It's a catchy song.,O çekici bir şarkı.
It's a celebration.,O bir kutlama.
It's a coincidence.,Bu bir tesadüf.
It's a common name.,Bu yaygın bir isim.
It's a common vice.,O yaygın bir ahlaksızlık.
It's a cruel world.,Dünya zalim.
It's a design flaw.,Bu bir tasarım kusuru.
It's a distraction.,O bir oyalama.
It's a funny movie.,Bu bir komik film.
It's a funny story.,Bu komik bir hikaye.
It's a good camera.,O iyi bir kamera.
It's a good choice.,Bu iyi bir tercih.
It's a good policy.,Bu iyi bir politika.
It's a good school.,"O, iyi bir okuldur."
It's a good system.,Bu iyi bir sistem.
It's a great party.,Bu harika bir parti.
It's a great start.,Harika bir başlangıç.
It's a great story.,Bu harika bir hikaye.
It's a happy thing.,O mutlu bir şey.
It's a huge gamble.,Büyük bir kumardı.
It's a lot of work.,Bu bir sürü iş.
It's a lovely idea.,Bu güzel bir fikir.
It's a new bicycle.,O yeni bir bisiklet.
It's a nice change.,Bu güzel bir değişiklik.
It's a perfect day.,Mükemmel bir gün.
It's a possibility.,Bu bir olasılık.
It's a proven fact.,O kanıtlanmış bir gerçek.
It's a red herring.,O kırmızı bir ringa.
It's a simple plan.,Bu basit bir plan.
It's a small world.,Bu küçük bir dünya.
It's a strange one.,Bu tuhaf biri.
It's a stupid idea.,"O, aptalca bir fikirdir."
It's a stupid rule.,Bu aptalca bir kural.
It's a stupid rule.,Bu saçma bir kural.
It's a typo. Sorry.,O bir yazım hatası. Özür dilerim.
It's a vague story.,O belirsiz bir hikaye.
It's a work of art.,O bir sanat eseri.
It's about to rain.,Yağmur yağmak üzere.
It's all new to me.,Bunun hepsi benim için yeni.
It's all our fault.,Hepsi bizim suçumuz.
It's all so absurd.,Bu tamamen çok saçma.
It's all up to Tom.,Bunun hepsi Tom'a kalmış.
It's all up to you.,Tamamen size kalmış.
It's almost summer.,Neredeyse yaz.
It's already seven.,Zaten saat 7:00.
It's an experiment.,Bu bir deney.
It's an expression.,Bu bir ifade.
It's an indulgence.,Bu bir hoşgörü.
It's an investment.,Bu bir yatırım.
It's an old custom.,Bu eski bir gelenek.
It's at the corner.,O köşededir.
It's badly damaged.,Kötü hasar gördü.
It's been exciting.,O heyecan vericiydi.
It's been horrible.,O korkunçtu.
It's been terrible.,O korkunçtu.
It's been too long.,Çok uzun zaman oldu.
It's begun to rain.,Yağmur yağmaya başladı.
"It's big, isn't it?","Bu büyük, değil mi?"
It's booby-trapped.,Bu bubi tuzaklı.
It's bound to rain.,Yağmur yağması kesin gibi.
It's cold out here.,Burası soğuk.
It's crowded today.,Bugün kalabalık.
It's different now.,Şimdi farklı.
It's disappointing.,Bu hayal kırıklığına uğratıcı.
It's disconcerting.,O kaygılı.
It's disconcerting.,O telaşlı.
It's easy for them.,Bu onlar için kolay.
It's exactly 10:00.,Tam olarak saat 10.00.
It's fairly unique.,Bu oldukça benzersiz.
It's far from here.,O buradan uzak.
It's far too small.,O çok fazla küçük.
It's for my family.,O benim ailem için.
It's for my friend.,Bu benim arkadaşım için.
It's fun to travel.,Seyahat etmek eğlencelidir.
It's getting light.,Hafifleşiyor.
It's getting worse.,Bu kötüleşiyor.
It's going to heal.,Bu iyileşecek.
It's going to hurt.,O incinecek.
It's going to rain.,Yağmur yağacak.
It's going to work.,O çalışacak.
It's good to dream.,Hayal kurmak iyidir.
It's good training.,İyi bir eğitim.
It's got to be now.,Bu şimdi olmak zorunda.
It's gotten better.,Daha iyi oldu.
It's gotten easier.,Bu daha kolay oldu.
It's happening now.,Şimdi oluyor.
It's heartbreaking.,"O, üzücüdür."
"It's him, isn't it?","Bu onun, değil mi?"
"It's his, isn't it?","O onun, değil mi?"
"It's his, isn't it?","O onunki, değil mi?"
It's hot down here.,Hava burada sıcak.
It's in good hands.,O emin ellerde.
It's in the closet.,O klozetin içinde.
It's in the drawer.,"O, çekmecede."
It's in the fridge.,"O, buzdolabında."
It's in the garage.,Garajda.
It's in your hands.,O senin ellerinde.
It's in your truck.,Bu sizin kamyonunuzda.
It's in your truck.,Bu senin kamyonunda.
It's just a rabbit.,Bu sadece bir tavşan.
It's just a theory.,Bu sadece bir varsayım.
It's just annoying.,Sadece sinir bozucu.
It's just business.,Bu sadece bir iş.
It's just not fair.,Hiç adil değil.
It's just not safe.,Bu gerçekten güvenli değil.
It's just so early.,Gerçekten çok erken.
It's just too soon.,Sadece çok erken.
It's just up ahead.,Bu sadece yukarıda ileride.
It's kind of funny.,O az çok komik.
It's kind of small.,Bu biraz küçük.
It's made of brass.,"Bu, pirinçten yapılmış."
It's made of paper.,Bu kağıttan yapılmış.
"It's me again, Tom.","Yine benim, Tom."
"It's me again, Tom.","Tekrar benim, Tom."
It's merely a joke.,O sadece bir şakadır.
"It's mine, not his.","O benim, onun değil."
It's my first time.,Bu benim ilk seferim.
It's my last offer.,Bu benim son teklifim.
It's nice and cool.,Bu güzel ve şirin.
It's nice and warm.,Bu güzel ve sıcak.
It's noisy in here.,Burası gürültülü.
It's not Christmas.,Noel değil.
It's not a disease.,Bu bir hastalık değil.
It's not a gimmick.,Bu bir hile değil.
It's not a holiday.,Bu bir tatil değil.
It's not a mistake.,O bir hata değil.
It's not a problem.,Sorun değil.
It's not backwards.,Geriye doğru değil.
It's not difficult.,Zor değil.
It's not effective.,Bu etkili değil.
It's not even true.,Bu gerçek bile değil.
It's not expensive.,"O, pahalı değil."
It's not his style.,Onun tarzı değil.
It's not important.,Önemli değil.
It's not important.,O önemli değil.
It's not like that.,Bu öyle değil.
It's not my choice.,Bu benim tercihim değil.
It's not necessary.,Gerekli değil.
It's not our fault.,Bu bizim hatamız değil.
It's not pertinent.,Uygun değil.
It's not practical.,Pratik değil.
It's not safe here.,Burası güvenli değil.
It's not so little.,"O, o kadar küçük değil."
It's not so simple.,Bu çok basit değil.
It's not that cold.,O kadar soğuk değil.
It's not that deep.,O kadar derin değil.
It's not that easy.,O kadar kolay değil.
It's not that hard.,O kadar da zor değil.
It's not that nice.,Bu o kadar hoş değil.
It's not there now.,O şimdi orada değil.
It's not too early.,Çok erken değil.
It's not too fancy.,Bu çok süslü değil.
It's not up to you.,Bu size kalmış değil.
It's not up to you.,Bu size bağlı değil.
It's not very good.,Bu çok iyi değil.
It's not very hard.,Bu çok zor değil.
It's not voluntary.,O gönüllü değil.
It's nothing major.,Bu önemli bir şey değil.
It's now up to you.,Bu şimdi size kalmış.
It's now your turn.,Şimdi sıra sizde.
It's only a theory.,O sadece bir teori.
It's our last hope.,Bu bizim son umudumuz.
It's our only hope.,Bu bizim tek umudumuz.
It's our only show.,Bu bizim tek gösterimiz.
It's our own fault.,Bu bizim kendi hatamız.
It's past midnight.,Vakit gece yarısını geçmiş.
It's pretty common.,Oldukça yaygın.
It's pretty simple.,Oldukça basit.
It's probably hard.,Bu muhtemelen zor.
It's probably true.,Bu muhtemelen doğru.
It's public record.,Bu kamu rekoru.
It's quite serious.,Bu oldukça ciddi.
It's quitting time.,İstifa etme zamanı.
It's raining again!,Yine yağmur yağıyor!
It's raining again.,Yeniden yağmur yağıyor.
It's raining there.,Orada yağmur yağıyor.
It's rather ironic.,O oldukça alaycı.
It's rather unique.,Oldukça benzersiz.
It's really a must.,Bu gerçekten bir zorunluluktur.
It's really boring.,Gerçekten sıkıcı.
It's really bright.,Bu gerçekten parlak.
It's really classy.,Gerçekten klas.
It's really pretty.,Gerçekten güzel.
It's really simple.,Gerçekten basit.
It's really smooth.,Gerçekten pürüzsüz.
It's really stinky.,O gerçekten kokmuş.
It's really unfair.,Bu gerçekten haksız.
"It's sad, but true.",Bu üzücü ama gerçek.
It's seven o'clock.,Saat yedi.
It's simple to use.,Bunu kullanmak basit.
It's snowing again.,Yine kar yağıyor.
It's snowing there.,Orada kar yağıyor.
It's snowing today.,Bugün kar yağıyor.
It's so depressing.,Çok iç karartıcı.
It's so impersonal.,Çok kişiliksiz.
It's so improbable.,Çok imkansız.
It's something new.,Bu yeni bir şey.
It's started again.,Tekrar başladı.
It's still crowded.,Hâlâ kalabalık.
It's still raining.,Hâlâ yağmur yağıyor.
It's still snowing.,Hâlâ kar yağıyor.
It's taken a while.,O bir süre aldı.
It's that personal.,Bu o kadar kişisel.
It's the other one.,"O, öbürküsü."
It's the same here.,Burada aynı.
It's the same here.,Burada da aynı.
It's the same here.,Burası da aynı.
It's the same wine.,O aynı şarap.
It's the wrong one.,Bu yanlış olan.
It's their problem.,Bu onların sorunu.
It's three o'clock.,Saat üç.
It's time Tom left.,Tom'un ayrılma zamanı geldi.
It's time for cake.,Pasta zamanı.
It's time to begin.,Başlama zamanı.
It's time to do it.,Bunu yapma zamanı.
It's time to leave.,Gitme zamanı.
It's time to party.,Parti zamanı.
It's time to sleep.,Uyku zamanı.
It's time to sleep.,Yatma zamanı.
It's time to sleep.,Yatma vakti.
It's time to start.,Başlama zamanı.
It's too dangerous!,Çok tehlikeli.
It's too dangerous.,Bu çok tehlikeli.
It's too difficult.,Bu çok zor.
It's too expensive!,Çok pahalı!
It's too expensive.,O çok pahalı.
It's totally wrong.,Bu tamamen yanlış.
It's truly amazing.,Bu gerçekten şaşırtıcı.
It's under the bed.,Yatağın altında.
It's unforgettable.,Bu unutulmaz.
It's unrecoverable.,Bu telafi edilemez.
It's up to Tom now.,Şimdi Tom'a kalmış.
It's up to you now.,Bu şimdi size kalmış.
It's very alarming.,Bu çok endişe verici.
It's very cold now.,Şimdi çok soğuk.
It's very detailed.,Bu çok ayrıntılı.
It's very exciting.,Bu çok heyecanlı.
It's very hot here.,Hava burada çok sıcak.
It's very late now.,Şimdi çok geç.
It's very personal.,Çok kişisel.
It's very puzzling.,Bu çok şaşırtıcı.
It's very relaxing.,Bu çok rahatlatıcı.
It's very romantic.,Bu çok romantik.
It's very slippery.,Çok kaygan.
It's very tempting.,Bu çok cazip.
It's very unlikely.,Çok olası değil.
It's very valuable.,Bu çok değerli.
It's way too early.,Çok erken.
It's way too heavy.,Çok fazla ağır.
It's way too small.,Bu çok fazla küçük.
It's well worth it.,O buna değer.
It's what I wanted.,İstediğim bu.
It's your decision.,O senin kararın.
Italy is in Europe.,İtalya Avrupadadır.
Jam comes in a jar.,Reçel kavanozda gelir.
"Join us, won't you?","Bize katılırsın, değil mi?"
Judge for yourself.,Kendin bak.
Judge for yourself.,Kendin karar ver.
Just do what I did.,Sadece yaptığımı yap.
Just do what I say.,Sadece söylediğimi yap.
Just don't be late.,Sadece geç kalma.
Just don't drop it.,Sadece düşürmeyin.
Just don't hurt me.,Sadece beni incitme.
Just don't kiss me.,Sadece beni öpme.
Just fill this out.,Sadece bunu doldur.
Just get back here.,Sadece buraya geri dön.
Just get over here.,Sadece buraya gel.
Just get rid of it.,Sadece ondan kurtul.
Just give it a try.,Sadece onu dene.
Just give it to me.,Sadece onu bana ver.
Just go and try it!,Sadece git ve dene!
Just hang in there.,Sık dişini.
Just hang in there.,Kendini bırakma.
Just how big is it?,Bu sadece ne kadar büyük?
Just let Tom speak.,Sadece Tom konuşsun.
Just let me finish.,Sadece bitireyim.
Just let me get up.,Sadece kalkayım.
Just let me see it.,Sadece onu göreyim.
Just listen to Tom.,Sadece Tom'u dinle.
Just open the door.,Sadece kapıyı aç.
Just remember that.,Sadece onu hatırla.
Just say something.,Sadece bir şey söyle.
Just say yes or no.,Sadece evet ya da hayır de.
Just sit and relax.,Sadece otur ve dinlen.
"Just sit down, Tom.","Sadece otur, Tom."
Just start talking.,Sadece konuşmaya başla.
Just start walking.,Sadece yürümeye başla.
Just take a number.,Sadece bir numara al.
Just talk with Tom.,Sadece Tom'la konuş.
Just think of that.,Sadece onu düşün.
Just throw it away.,Sadece onu fırlat.
Just wait a minute.,Sadece bir dakika bekle.
Just wait a moment.,Sadece bir süre bekleyin.
Just wait a second.,Sadece bir saniye bekle.
"Just water, please.","Sadece su, lütfen."
Keep a low profile.,Dikkat çekmemeye çalış.
Keep an eye on Tom.,Tom'a göz kulak ol.
Keep an eye on him.,Ona göz kulak ol.
Keep away from Tom.,Tom'dan uzak dur.
Keep going forward.,İlerlemeye devam et.
"Keep it down, guys.","Sessiz olun, çocuklar."
Keep off the grass!,Çimlere basmayın!
Keep off the grass.,Çimlere basmayın.
Keep out of my way.,Yolumdan uzak dur.
Keep the door open.,Kapıyı açık tutun.
Keep the lights on.,Işıkları açık tut.
Keep working at it.,Onun için çaba göstermeye devam et.
Keep your distance.,Araya mesafe koy.
Keep your hands up.,Ellerini yukarıda tut.
Keep your head low.,Başını aşağıda tut.
Keep your pants on.,Pantolonunu üstünde tut.
Keep your promises.,Sözlerini tut.
Keep your shirt on.,Biraz sabırlı ol!
Keep your shoes on.,Ayakkabını çıkarma.
Kids learn quickly.,Çocuklar çabuk öğrenir.
Kids make mistakes.,Çocuklar hatalar yapar.
"Knock it off, guys.","Kesin şunu, çocuklar."
Knowledge is power.,Bilgi güçtür.
Land came in sight.,Kara göründü.
Last night was fun.,Dün gece eğlenceliydi.
Last week was cold.,Geçen hafta soğuktu.
Last week was cool.,Geçen hafta serindi.
Laws are necessary.,Yasalar gereklidir.
Leave here at once.,Derhal burayı terk et.
Leave me alone now.,Beni şimdi yalnız bırak.
"Leave me alone, OK?","Beni yalnız bırak, tamam mı?"
Leave me out of it.,Beni bu işe karıştırma.
Leave my car alone.,Arabamı yalnız bırakın.
Leaves are falling.,Yapraklar dökülüyor.
Legal help is here.,Yasal yardım burada.
Lesson Two is easy.,Ders iki kolaydır.
Let Tom do his job.,Bırak da Tom işini yapsın.
Let Tom stay there.,Tom'un orada kalmasına izin ver.
Let Tom talk first.,Önce Tom'un konuşmasına izin ver.
Let go of the rope.,İpi bırak.
Let her replace it.,"O, onu değiştirsin."
Let him pay for it.,Onun için ödesin.
Let me borrow that.,Onu ödünç almama izin ver.
Let me concentrate.,Konsantre olayım.
Let me do this one.,Bunu yapayım.
Let me explain why.,Sebebini açıklayayım.
Let me fix the car.,Arabayı tamir edeyim.
Let me get my coat.,Paltomu alayım.
Let me get you one.,Sana bir tane alayım.
Let me go with Tom.,Tom'la gideyim.
Let me go with Tom.,Tom'la gitmeme izin ver.
Let me go with you.,Seninle gitmeme izin ver.
Let me go with you.,Seninle gideyim.
Let me grab my bag.,Çantamı alayım.
Let me handle that.,Bana bırak.
Let me handle this.,Bırak bunu ben halledeyim.
Let me have a look.,Bir göz atayım.
Let me help you up.,Sana yardım edeyim.
Let me just finish.,Sadece bitireyim.
Let me look at you.,Sana bakmama izin ver.
Let me out of here.,Buradan çıkayım.
Let me pay tonight.,Bu gece ben ödeyeyim.
Let me repeat that.,Onu tekrar edeyim.
Let me repeat this.,Bunu tekrarlayayım.
Let me rephrase it.,Onu başka şekilde ifade edeyim.
Let me see some ID.,Bir kimlik göreyim.
Let me sleep on it.,Bunun üstünde uyuyayım.
Let me speak first.,Önce ben konuşayım.
Let me step inside.,İçeri girebilir miyim?
Let me take a look.,Bir göz atalım.
Let me talk to Tom.,Tom'la konuşmama izin ver.
Let me talk to Tom.,Tom'la konuşayım.
Let me talk to you.,Seninle konuşmama izin ver.
Let me verify that.,Onu doğrulayayım.
Let the game begin.,Oyun başlasın.
Let the show begin.,Gösteri başlasın.
Let us do the work.,İşi yapmamıza izin verin.
Let us talk to Tom.,Tom'la konuşalım.
Let's all help Tom.,Hepimiz Tom'a yardım edelim.
Let's attack again.,Tekrar saldıralım.
Let's bake cookies.,Kurabiyeleri pişirelim.
Let's be real here.,Burada gerçek olalım.
Let's be realistic.,Gerçekçi olalım.
Let's build a fire.,Ateş yakalım.
Let's buy this one.,Bunu alalım.
Let's call Tom now.,Şimdi Tom'u arayalım.
Let's catch a bite.,Bir lokma ısıralım.
Let's change seats.,Hadi koltukları değiştirelim.
Let's check it out.,Hadi onu dışarıda kontrol edelim.
Let's discuss this.,Bunu görüşelim.
Let's do something.,Bir şey yapalım.
Let's do that soon.,Bunu yakında yapalım.
Let's double check.,İki kez kontrol edelim.
Let's drink coffee.,Kahve içelim.
Let's eat hot dogs.,Sosisli sandviç yiyelim.
Let's eat sukiyaki.,Hadi sukiyaki yiyelim.
Let's eat together.,Birlikte yemek yiyelim.
Let's face reality.,Gerçekle yüzleşelim.
Let's find out why.,Nedenini bulalım.
Let's get cracking!,Başlayalım!
Let's get divorced.,Boşanalım.
Let's get off here.,Burada inelim.
Let's get prepared.,Hazırlanalım.
Let's get that one.,Şunu alalım.
Let's get together.,Buluşalım.
Let's get you home.,Seni eve götürelim.
Let's give it a go.,Ona bir şans verelim.
Let's go back home.,Eve geri gidelim.
Let's go get drunk.,Kafayı bulmaya gidelim.
Let's go get lunch.,Öğle yemeği almaya gidelim.
"Let's go home, Tom.","Eve gidelim, Tom."
Let's go somewhere.,Bir yere gidelim.
Let's go to Boston.,Boston'a gidelim.
Let's go to church.,Hadi kiliseye gidelim.
Let's go to dinner.,Akşam yemeğine gidelim.
Let's go visit Tom.,Tom'u ziyaret etmeye gidelim.
Let's have a drink.,Bir içki içelim.
Let's have a party.,Bir parti verelim.
Let's have another.,Bir tane daha alalım.
Let's hit the road.,Yola koyulalım.
Let's hit the sack.,Kafayı vurup yatalım.
Let's just do this.,Hadi sadece bunu yapalım.
Let's just drop it.,Hadi sadece onu düşürelim.
Let's just go away.,Sadece çekip gidelim.
Let's just go home.,Hemen eve gidelim.
Let's just say yes.,Sadece evet diyelim.
Let's keep looking.,Aramaya devam edelim.
Let's keep talking.,Konuşmaya devam edelim.
Let's look into it.,Onun içine bakalım.
Let's look outside.,Dışarıya bakalım.
Let's make a trade.,Ticaret yapalım.
Let's make it 3:00.,Onu 3:00 yapalım.
Let's meet at 2:30.,2.30'da buluşalım.
Let's meet at 6:30.,Saat 6.30'da buluşalım.
Let's meet at five.,Saat beşte buluşalım.
Let's move the bed.,Yatmaya gidelim.
Let's not be catty.,Hain olmayalım.
Let's not be hasty.,Aceleci olmayalım.
Let's not be naive.,Saf olmayalım.
Let's not complain.,Şikayet etmeyelim.
Let's not go there.,Oraya gitmeyelim.
Let's not squabble.,Kavga etmeyelim.
Let's not watch TV.,TV izlemeyelim.
Let's play outside.,Dışarıda oynayalım.
Let's rest a while.,Biraz dinlenelim.
Let's see who wins!,Kimin kazanacağını görelim.
Let's sit up front.,Önde oturalım.
Let's sit with Tom.,Tom ile oturalım.
Let's sit with Tom.,Tom'la oturalım.
Let's skip dessert.,Tatlıyı atlayalım.
