input_text,target_text
You're very sharp.,Çok keskinsin.
You're very smart.,Çok akıllısın.
You're very sweet.,Çok tatlısın.
You're very timid.,Çok ürkeksin.
You're very upset.,Çok üzgünsün.
You're very young.,Sen çok gençssin.
"You're wrong, Tom.","Sen yanılıyorsun, Tom."
You've been great.,Harikaydın.
You've been there.,Sen oradaydın.
You've done a lot.,Çok şey yaptın.
You've got a deal.,Bir anlaşman var.
You've got a rash.,Senin bir isiliğin var.
You've got cancer.,Kanserin var.
You've got it now.,O artık senin.
You've got skills.,Yeteneklerin var.
You've got to win.,Kazanmak zorundasın
You've gotten fat.,Şişmanladın.
You've had enough.,Yeterince yaşadın.
You've never lost.,Hiç kaybolmadın.
You've seen worse.,Daha kötüsünü gördün.
Your arm's broken.,Kolun kırık.
Your book is here.,Kitabın burada.
Your face is pale.,Yüzünüz solgun.
Your feet are big.,Senin ayakların büyük.
Your hat is silly.,Sizin şapka aptalca.
Your house is big.,Eviniz büyük.
Your house is big.,Senin evin büyük.
Your idea is good.,Senin fikrin iyi.
Your lies pain me.,Senin yalanların beni üzüyor.
Your lips are red.,Dudakların kırmızı.
"Your name, please.","Adınız, lütfen."
"Your name, please.","Adın, lütfen."
Your room is neat.,Sizin odanız temiz.
Your room's ready.,Odan hazır.
Your room's ready.,Senin odan hazır.
Your seat's there.,Senin koltuğun orada.
Your time is over.,Vaktin bitti.
Your vote matters.,Sizin oyunuz önemlidir.
Your wife is here.,Karın burada.
Your work is done.,İşin tamam.
A boy ran up to me.,Bir çocuk bana doğru koştu.
A cat is not human.,Bir kedi insan değildir.
A cat scratched me.,Bir kedi beni beni tırmaladı.
A child is missing.,Bir çocuk kayıp.
A child needs love.,Bir çocuğun sevgiye ihtiyacı vardır.
A guard is outside.,Bir koruma dışarıda.
A guard is outside.,Bir bekçi dışarıda.
A guard is outside.,Dışarıda bir gardiyan var.
A lot has happened.,Birçok şey oldu.
A man overtook her.,Bir adam onu ele geçirdi.
A revolt broke out.,Bir ayaklanma patlak verdi.
A storm is brewing.,Bir fırtına patlamak üzeredir.
A typhoon's coming.,Bir tayfun geliyor.
Add it to the list.,Onu listeye ekle.
Admission was free.,Giriş ücretsizdi.
All apples are red.,Bütün elmalar kırmızıdır.
All is quiet again.,Her şey tekrar sakin.
All is quiet again.,Her şey tekrar sessiz.
All men are mortal.,Bütün insanlar ölümlüdür.
All men want money.,Bütün insanlar para isterler.
All my plants died.,Tüm bitkilerim öldü.
All of us are busy.,Hepimiz meşgulüz.
All of us know Tom.,Tom'u hepimiz tanırız.
All of us like Tom.,"Hepimiz Tom'dan hoşlanıyoruz, değil mi?"
All of us like her.,Hepimiz onu severiz.
All of us like you.,Hepimiz seni seviyoruz.
All of us stood up.,Hepimiz ayağa kalktık.
All sugar is sweet.,Bütün şeker tatlıdır.
All systems are go.,Tüm sistemler denemedir.
All we do is study.,Bütün yapacağımız çalışmaktır.
All were satisfied.,Herkes memnundu.
All you do is work.,Yapacağın tek şey çalışmak
Allow me to finish.,Bitirmeme izin ver.
Am I being foolish?,Ben aptal mı oluyorum?
Am I being foolish?,Aptalca mı davranıyorum?
Am I bothering you?,Seni rahatsız ediyor muyum?
Am I confusing you?,Kafanı karıştırıyor muyum?
Am I free to leave?,Gidebilir miyim?
Am I free to leave?,Gitmekte özgür müyüm?
Am I going to jail?,Hapse girecek miyim?
Am I seeing things?,Ben hayal mi görüyorum.
Am I too demanding?,Çok talepkar mıyım?
An idea came to me.,Aklıma bir fikir geldi.
Another day passed.,Bir gün daha geçti.
Answer my question.,Soruma cevap ver.
Answer my question.,Sorumu yanıtla!
Any child knows it.,Herhangi bir çocuk onu bilir.
Anybody can use it.,Herkes bunu kullanabilir.
Anyhow let's begin.,Ne olursa olsun başlayalım.
Anyone can do that.,Herhangi biri onu yapabilir.
Anything goes here.,Oraya bir şey gidiyor.
Anything will help.,Her şey yardımcı olacaktır.
Applause broke out.,Alkış patlak verdi.
Are meals included?,Yemekler dahil mi?
Are my children OK?,Çocuklarım iyi mi?
Are these for sale?,Bunlar satılık mı?
Are these from Tom?,Bunlar Tom'dan mı?
Are they all ready?,Onların hepsi hazır mı?
Are they criminals?,Onlar suçlu mu?
Are they pacifists?,Onlar barış yanlısı mı?
Are they poisonous?,Onlar zehirli mi?
Are they ready yet?,Henüz onlar hazır mı?
Are they satisfied?,Onlar memnun mu?
Are they satisfied?,Memnunlar mı?
Are they still mad?,Onlar hâlâ kızgın mı?
Are things bad now?,Artık işler kötü mü?
Are we bad parents?,Biz kötü ebeveyn miyiz?
Are we coming back?,Geri dönüyor muyuz?
Are we leaving now?,Şimdi gidiyor muyuz?
Are we on schedule?,Vaktinde miyiz?
Are we ready to go?,Gitmek için hazır mıyız?
Are you a Buddhist?,Bir budist misin?
Are you a Canadian?,Sen bir Kanadalı mısın?
Are you a bachelor?,Bekar mısın?
Are you a believer?,Allah'a inanır mısınız?
Are you a criminal?,Bir sabıkalı mısın?
Are you a musician?,Bir müzisyen misiniz?
Are you a musician?,Bir müzisyen misin?
Are you a prisoner?,Bir mahkum musun?
Are you a prisoner?,Sen bir tutuklu musun?
Are you a reporter?,Sen bir muhabir misin?
Are you about done?,İşin bitti mi?
Are you about done?,İşin bitmek üzere mi?
Are you all morons?,Hepiniz geri zekalı mısınız?
Are you an atheist?,Sen bir ateist misin?
Are you an athlete?,Sen bir atlet misin?
Are you an elitist?,Sen bir seçkinci misin?
Are you an elitist?,Elitist misin?
Are you analytical?,Sen analitik misin?
Are you badly hurt?,Kötü yaralandın mı?
Are you better now?,Şimdi daha iyi misin?
Are you blaming me?,Beni mi suçluyorsun?
Are you bored here?,Burada sıkıldın mı?
Are you both crazy?,Her ikiniz de deli misiniz?
Are you both drunk?,Her ikiniz de sarhoş musunuz?
Are you busy today?,Bugün meşgul müsünüz?
Are you busy today?,Bugün meşgul müsün?
Are you courageous?,Yürekli misin?
Are you dating Tom?,Tom'la çıkıyor musun?
Are you dependable?,Sen güvenilir misin?
Are you doing well?,iyimisin?
Are you doing well?,İyi yapıyor musun?
Are you down there?,Aşağıda mısın?
Are you easy-going?,Sen uysal mısın?
Are you ever happy?,Sen hiç mutlu musun?
Are you feeling OK?,İyi hissediyor musunuz?
Are you free today?,Bugün boş musun?
Are you frightened?,Korkuyor musun?
Are you from Kyoto?,Kyotolu musunuz?
Are you going home?,Eve gidiyor musun?
Are you going home?,Eve mi gidiyorsun?
Are you going home?,Eve mi gidiyorsunuz?
"Are you going, too?",Sen de gidiyor musun?
"Are you going, too?",Sen de mi gidiyorsun?
Are you good at it?,Bunda iyi misin?
Are you guys armed?,Siz silahlı mısınız?
Are you guys armed?,Siz arkadaşlar silahlı mısınız?
Are you guys close?,Siz yakın mısınız?
Are you guys close?,Siz arkadaşlar yakın mısınız?
Are you guys crazy?,Siz deli misiniz?
Are you guys crazy?,Siz arkadaşlar deli misiniz?
Are you guys happy?,Siz mutlu musunuz?
Are you guys ready?,Hazır mısınız?
Are you guys ready?,Siz arkadaşlar hazır mısınız?
Are you happy here?,Burada mutlu musun?
"Are you happy, Tom?","Mutlu musun, Tom?"
Are you having fun?,Sen eğleniyor musun?
Are you her friend?,Onun arkadaşı mısın?
Are you here alone?,Burada yalnız mısın?
Are you here alone?,Burada yalnız başına mısın?
Are you here alone?,Burada tek başına mısın?
Are you home alone?,Evde yalnız mısın?
Are you hungry now?,Şimdi aç mısınız?
Are you hungry yet?,Henüz aç mısın?
Are you hungry yet?,Henüz aç mısınız?
Are you illiterate?,Okuma yazma bilmiyor musun?
Are you in a hurry?,Aceleniz var mı?
Are you in trouble?,Başın dertte mi?
Are you innovative?,Yenilikçi misin?
Are you interested?,İlgileniyor musunuz?
Are you kidding me?,Benimle dalga mı geçiyorsun?
Are you kidding me?,Benimle alay mı ediyorsun?
Are you mad at Tom?,Tom'a kızgın mısın?
Are you methodical?,Sen düzenli misin?
Are you mocking me?,Benimle alay mı ediyorsun?
Are you on holiday?,Tatilde misiniz?
Are you optimistic?,İyimser misin?
Are you overweight?,Şişman mısın?
Are you prejudiced?,Sen önyargılı mısın?
Are you productive?,Sen üretken misin?
Are you quite sure?,Oldukça emin misin?
"Are you ready, Tom?","Hazır mısın, Tom?"
Are you really Tom?,Sen gerçekten Tom musun?
Are you registered?,Kayıtlı mısınız?
Are you scared now?,Şimdi korkuyor musun?
Are you sick of me?,Benden bıktın mı?
Are you sleepy yet?,Hâlâ uykulu musunuz?
Are you still busy?,Hala meşgul müsün?
Are you still busy?,Hâlâ meşgul müsün?
Are you still cold?,Hâlâ üşüyor musun?
Are you still here?,Hâlâ burada mısın?
Are you still home?,Sen hâlâ evde misin?
Are you still open?,Hâlâ açık mısınız?
Are you still sick?,Hâlâ hasta mısın?
Are you still sure?,Hâlâ emin misin?
Are you sure of it?,Bunun hakkında emin misin?
Are you teasing me?,Benimle alay mı ediyorsun?
Are you that dense?,O kadar yoğun musun?
Are you the doctor?,Doktor sen misin?
"Are you there, Tom?","Orada mısın, Tom?"
Are you two hungry?,İkiniz aç mısınız?
Are you two hungry?,Siz ikiniz aç mısınız?
Are you using that?,Onu kullanıyor musun?
Are you vegetarian?,Vejetaryen misin?
Are you vegetarian?,Vejetaryen misiniz?
Are you vegetarian?,Sen vejetaryen misin?
Are your eyes open?,Gözleriniz açık mı?
Are your eyes open?,Gözlerin açık mı?
Are your feet cold?,Ayakların üşüyor mu?
Are your shoes new?,Ayakkabılarınız yeni mi?
Aren't you all mad?,Hepiniz deli değil misiniz?
Aren't you anxious?,Endişeli değil misin?
Aren't you ashamed?,Utanmıyor musunuz?
Aren't you ashamed?,Utanmıyor musun?
Aren't you curious?,Meraklı değil misin?
Aren't you curious?,Meraklı değil misiniz?
Aren't you doctors?,Siz doktor değil misiniz?
Aren't you excited?,Sen heyecanlı değil misin?
Aren't you furious?,Öfkeli değil misin?
Aren't you in pain?,Acı çekmiyor musun?
Aren't you in town?,Şehirde değil misin?
Aren't you in town?,Kasabada değil misiniz?
Aren't you insured?,Sen sigortalı değil misin?
Aren't you jealous?,Kıskanç değil misin?
Aren't you married?,Evli değil misin?
Aren't you married?,Evli değil misiniz?
Aren't you nervous?,Sinirli değil misin?
Aren't you nervous?,Sinirli değil misiniz?
Aren't you over 18?,18 yaşın üstünde değil misin?
Aren't you pleased?,Memnun değil misin?
Aren't you psyched?,Heyecanlı değil misin?
Aren't you psychic?,Sen medyum değil misin?
Aren't you related?,Siz akraba değil misiniz?
Aren't you retired?,Sen emekli değil misin?
Aren't you sisters?,Siz kız kardeş değil misiniz?
Aren't you thirsty?,Susamadın mı?
Aren't you thirsty?,Susamadınız mı?
Aren't you worried?,Endişeli değil misin?
Ask Tom for advice.,Tom'dan tavsiye iste.
Ask Tom to call me.,Tom'un beni aramasını iste.
Ask Tom to join us.,Tom'un bize katılmasını iste.
Ask for more money.,Daha fazla para isteyin.
Ask her for advice.,Ondan tavsiye iste.
Ask him for advice.,Ondan tavsiye iste.
Attendance is free.,Katılım ücretsiz.
Back away from Tom.,Tom'dan uzaklaş.
Back up your files.,Dosyalarını yedekle.
Bananas are yellow.,Muzlar sarıdır.
Baseball is boring.,Beyzbol sıkıcıdır.
Be a good listener.,İyi bir dinleyici olun.
Be careful with it.,Onunla dikkatli ol.
Be kind to the old.,Yaşlılara karşı iyi kalpli olun.
Beer contains hops.,Bira şerbetçiotu içerir.
Better him than me.,Ben olmaktansa onun olması daha iyi.
Big boys don't cry.,Büyük oğlanlar ağlamaz.
Birds are chirping.,Kuşlar cıvıldıyor.
Black is beautiful.,Siyah güzeldir.
Books fascinate me.,Kitaplar beni büyüler.
Boston is changing.,Boston değişiyor.
Both girls laughed.,Kızların her ikisi de güldü.
Both men were shot.,Her iki adam da vuruldu.
Both soldiers died.,Her iki asker öldü.
Both women grinned.,Her iki kadın sırıttı.
Boy that was close.,Yakın olan çocuk.
"Boys, be ambitious.","Çocuklar, hırslı olun."
Breakfast is ready.,Kahvaltı hazır.
Bring Tom with you.,Tom'u yanında getir.
Bring Tom with you.,Tom'u seninle getir.
Bring me the flute.,Bana flütü getir.
Bring your friends.,Arkadaşlarını getir.
Bring your own mug.,Kendi kupanızı getirin.
"Buy low, sell high.","Düşük al, yüksek sat."
Caffeine is a drug.,Kafein bir uyuşturucudur.
Call 110 right now.,Hemen şimdi 110'u arayın.
Call 110 right now.,Hemen şimdi 110'u ara.
Call me right away.,Beni hemen ara.
Call me right back.,Beni derhal tekrar ara.
Call off your dogs.,Köpeklerini durdur.
Camp ends tomorrow.,Kamp yarın sona eriyor.
Can I borrow a pen?,Bir kalem ödünç alabilir miyim?
Can I borrow those?,Ben onları ödünç alabilir miyim?
Can I borrow yours?,Seninkini ödünç alabilir miyim?
Can I call you Tom?,Sana Tom diyebilir miyim?
Can I check in now?,Şimdi giriş yapabilir miyim?
Can I count on Tom?,Tom'a güvenebilir miyim?
Can I count on you?,Sana güvenebilir miyim?
Can I do it myself?,Bunu kendim yapabilir miyim?
Can I do that here?,Onu burada yapabilir miyim?
Can I drop you off?,Seni araçtan indirebilir miyim?
Can I get a pillow?,Bir yastık alabilir miyim?
Can I get a refund?,Para iadesi alabilir miyim?
Can I get a tattoo?,Bir dövme yaptırabilir miyim?
Can I go there now?,Şimdi oraya gidebilir miyim?
Can I have a donut?,Bir çörek alabilir miyim?
Can I have a donut?,Bir lokma alabilir miyim?
Can I have it back?,Onu geri alabilir miyim?
Can I hide in here?,Burada gizlenebilir miyim?
Can I open my eyes?,Gözlerimi açabilir miyim?
Can I question Tom?,Tom'a soru sorabilir miyim?
Can I rent rackets?,Raketleri kiralayabilir miyim?
Can I say it aloud?,Yüksek sesle söyleyebilir miyim?
Can I see it again?,Onu tekrar görebilir miyim?
Can I see that one?,Ben onu görebilir miyim?
Can I see this one?,Ben bunu görebilir miyim?
Can I sit with Tom?,Tom'la oturabilir miyim?
Can I sit with you?,Sizinle oturabilir miyim?
Can I speak to Tom?,Tom'la konuşabilir miyim?
Can I speak to you?,Sizinle konuşabilir miyim?
Can I take a break?,Mola verebilir miyim?
Can I take it home?,Bunu eve götürebilir miyim?
Can I tell Tom why?,Nedenini Tom'a söyleyebilir miyim?
Can I try it later?,Onu daha sonra deneyebilir miyim?
Can I try one more?,Bir daha deneyebilir miyim?
Can I use your pen?,Ben senin kalemini kullanabilir miyim?
Can Tom be trusted?,Tom'a güvenilebilinir mi?
Can Tom be trusted?,Tom'a güvenilebilir mi?
Can Tom do the job?,Tom işi yapabilir mi?
Can anyone comment?,Herhangi biri yorum yapabilir mi?
Can anyone hear me?,Herkes beni duyabiliyor mu?
Can anyone help me?,Biri bana yardım edebilir mi?
Can he do this job?,O bu işi yapabilir mi?
Can it be repaired?,O tamir edilebilir mi?
Can it be replaced?,Bu değiştirilebilir mi?
Can it happen here?,O burada olabilir mi?
Can they do better?,Onlar daha iyi yapabilir mi?
Can we afford that?,Onu göze alabilir miyiz?
Can we afford this?,Buna gücümüz yeter mi?
Can we afford this?,Bunu göze alabilir miyiz?
Can we do it again?,Onu tekrar yapabilir miyiz?
Can we do that now?,Onu şimdi yapabilir miyiz?
Can we get started?,Başlayabilir miyiz?
Can we go back now?,Şimdi geri gidebilir miyiz?
Can we go home now?,Şimdi eve gidebilir miyiz?
Can we go upstairs?,Yukarı gidebilir miyiz?
Can we go upstairs?,Üst kata çıkabilir miyiz?
Can we have a talk?,Konuşabilir miyiz?
Can we have it now?,Onu şimdi alabilir miyiz?
Can we rely on Tom?,Tom'a güvenebilir miyiz.
Can we see Tom now?,Tom'u şimdi görebilir miyiz?
Can we speed it up?,Onu hızlandırabilir miyiz?
Can we talk inside?,İçeride konuşabilir miyiz?
Can we talk to Tom?,Tom'la konuşabilir miyiz?
Can we talk to Tom?,Tom ile konuşabilir miyiz?
Can we talk to you?,Seninle konuşabilir miyiz?
Can you and I talk?,Sen ve ben konuşabilir miyiz?
Can you arrange it?,Onu düzenleyebilir misin?
Can you believe it?,Ona inanabiliyor musun?
Can you blame them?,Onları suçlayabiliyor musun?
Can you call ahead?,Önceden arayabilir misin?
Can you come early?,Erken gelebilir misin?
Can you deliver it?,Bunu teslim edebilir misin?
"Can you do it, Tom?","Onu yapabilir misin, Tom?"
Can you fix my car?,Arabamı onarabilir misin?
Can you forgive me?,Beni affeder misiniz?
Can you forgive us?,Bizi affedebilir misin?
Can you go with us?,Bizimle birlikte gidebilir misin?
Can you keep quiet?,Sessiz kalabilir misin?
Can you look at me?,Bana bakar mısın?
Can you pick it up?,Onu alabilir misin?
Can you pick me up?,Beni alabilir misin?
Can you picture it?,Onu hayal edebiliyor musun?
Can you prevent it?,Onu önleyebilir misin?
Can you prevent it?,Onu engelleyebilir misin?
Can you protect me?,Beni koruyabilir misin?
Can you protect us?,Bizi koruyabilir misin?
Can you prove that?,Bunu ispatlayabilir misin?
Can you see anyone?,Herhangi birini görebiliyor musun?
Can you smell that?,Onu koklayabilir misin?
Can you still swim?,Hâlâ yüzebiliyor musun?
Can you still walk?,Hâlâ yürüyebiliyor musun?
Can you support me?,Bana destek olur musun?
Can you support me?,Beni destekler misin?
Can you trust them?,Onlara güvenebilir misin?
Can you understand?,Anlayabiliyor musun?
Can you wait a bit?,Biraz bekler misin?
Can't you see that?,Onu göremiyor musun?
Can't you sense it?,Bunu hissedemiyor musun?
Can't you stop Tom?,Tom'u durduramaz mısın?
Caption this photo.,Bu fotoğrafa alt yazı koy.
Cars are expensive.,Arabalar pahalı.
Cars are necessary.,Arabalar gereklidir.
Cars pollute a lot.,Arabalar çok kirletir.
Cats are not human.,Kediler insan değildir.
Caution is advised.,Dikkat tavsiye edilir.
Change is possible.,Değişim mümkündür.
Change the subject.,Konuyu değiştir.
Check the calendar.,Takvimi kontrol et.
Check this one out.,Bunu kontrol et.
Check your pockets.,Ceplerini kontrol et.
Chen is not Korean.,Chen Koreli değil.
Children are dying.,Çocuklar ölüyor.
Children like cake.,Çocuklar pastayı sever.
Children love cake.,Çocuklar pasta seviyor.
Children need love.,Çocukların sevgiye ihtiyacı var.
Choose to be happy.,Mutlu olmayı seç.
Choose your weapon.,Silahını seç.
Clean up that mess.,O pisliği temizleyin.
Clean up this mess.,Bu pisliği temizle.
Clean up your room.,Odanı temizle.
Close the shutters.,Kepenkleri kapat.
"Cold water, please.","Soğuk su, lütfen."
Come along with me.,Benimle birlikte gel.
Come along with us.,Bizimle birlikte gel.
Come and sit by me.,Gel ve yanıma otur.
Come back tomorrow.,Yarın geri gel.
Come here a second.,Bir saniye gel buraya!
Come here and help.,Buraya gel ve yardım et.
"Come in, it's open.","Kapı açık, içeri gir."
Come into the room.,Odaya gel.
Come near the fire.,Ateşin yanına gel.
"Come on, follow me.","Hadi, beni izle."
"Come on, it's easy.","Hadi, bu kolay."
"Come on, try again.","Hadi, tekrar deneyin."
Come over any time.,Her zaman uğra.
Come party with us.,Bizimle birlikte partiye gel.
Come visit us soon.,Yakında bizi ziyaret etmeye gel.
Consider it a gift.,Bunu bir hediye olarak düşünün.
Consider the facts.,Gerçekleri göz önünde bulundurun.
Control yourselves.,Kendinizi kontrol edin.
Could I have a sip?,Bir yudum alabilir miyim?
Could Tom be wrong?,Tom hatalı olabilir mi?
Could this be love?,Bu aşk olabilir mi?
Could we leave now?,Şimdi gidebilir miyiz?
Could we order now?,Şimdi sipariş edebilir miyiz?
Could you call Tom?,Tom'u arar mısınız?
Could you use this?,Bunu kullanabilir misiniz?
Count up to thirty.,Otuza kadar say.
Crime does not pay.,Suçlu önünde sonunda yakalanır.
Crime does not pay.,Suçlu er geç yakayı ele verir.
Cross your fingers.,Şans dile.
Cut Tom some slack.,Tom'a biraz müsamaha göster.
Cut back on sweets.,Şekerlemeyi azalt.
Cut down that tree.,O ağacı kes.
Deal with it later.,Onunla daha sonra uğraş.
Describe Tom to me.,Tom'u bana tanımla.
Did I frigthen you?,Seni korkuttum mu?
Did I get it right?,Onu doğru anladım mı?
Did I just do that?,Ben sadece bunu mu yaptım?
Did I mention that?,Ondan bahsettim mi?
Did I say it wrong?,Onu yanlış mı söyledim?
Did I say too much?,Çok fazla söyledim mi?
Did I surprise you?,Seni şaşırttım mı?
Did Tom believe it?,Tom buna inandı mı?
Did Tom bribe Mary?,Tom Mary'ye rüşvet verdi mi?
Did Tom cause this?,Buna Tom mu sebep oldu?
Did Tom eat dinner?,Tom akşam yemeği yedi mi?
Did Tom have a gun?,Tom'un bir silahı var mıydı?
Did Tom just leave?,Tom az önce gitti mi?
Did Tom look angry?,Tom kızgın görünüyor muydu?
Did Tom look upset?,Tom üzgün görünüyor muydu?
Did Tom mention me?,Tom benden söz etti mi?
Did Tom really win?,Tom gerçekten kazandı mı?
Did Tom say thanks?,Tom teşekkür etti mi?
Did Tom seem happy?,Tom mutlu görünüyor muydu?
Did Tom seem upset?,Tom üzgün görünüyor muydu?
Did Tom sleep well?,Tom iyi uyudu mu?
Did Tom work there?,Tom orada çalıştı mı?
Did anyone call me?,Beni arayan oldu mu?
Did anyone call me?,Biri beni aradı mı?
Did anyone hear me?,Biri beni duydu mu?
Did anyone miss me?,Kimse beni özledi mi?
Did everyone agree?,Herkes kabul etti mi?
Did she sleep well?,O iyi uyudu mu?
Did they live here?,Onlar burada yaşadılar mı?
Did we wake you up?,Seni uyandırdık mı?
Did you arrest Tom?,Tom'u tutukladın mı?
Did you break that?,Onu kırdın mı?
Did you bring them?,Onları getirdin mi?
Did you catch them?,Onları yakaladın mı?
Did you check this?,Bunu kontrol ettin mi?
Did you enjoy that?,Ondan hoşlandın mı?
Did you feel happy?,Sen mutlu hissettin mi?
Did you get a beer?,Bir bira içtin mi?
Did you get robbed?,Soyuldun mu?
Did you have plans?,Planların var mıydı?
Did you invite Tom?,Tom'u davet ettin mi?
Did you invite him?,Onu davet ettin mi?
Did you kidnap Tom?,Tom'u kaçırdın mı?
Did you lie to Tom?,Tom'a yalan söyledin mi?
Did you murder Tom?,Tom'u öldürdün mü?
Did you notify Tom?,Tom'a bildirdin mi?
Did you order this?,Bunu sipariş ettin mi?
Did you paint this?,Bunu boyadın mı?
Did you poison Tom?,Tom'u zehirledin mi?
Did you see anyone?,Kimseyi gördün mü?
Did you sleep here?,Burada uyudun mu?
Did you sleep here?,Burada mı uyudun?
Did you sleep well?,İyi uyudun mu?
Did you steal this?,Bunu çaldın mı?
Did you write that?,Onu yazdın mı?
Didn't he go there?,Oraya gitmedin mi?
Didn't you do that?,Bunu sen yapmadın mı?
Didn't you get one?,Bir tane almadın mı?
Didn't you hear me?,Beni duymadın mı?
Didn't you miss it?,Onu özlemedin mi?
Didn't you miss me?,Beni özlemedin mi?
Dinner was awesome.,Akşam yemeği harikaydı.
Divide and conquer.,Böl ve fethet.
Do I have a choice?,Bir seçeneğim var mı?
Do I have to study?,Çalışmak zorunda mıyım?
Do I look like Tom?,Tom'a benziyor muyum?
Do I look paranoid?,Paranoyak görünüyor muyum?
Do I need a lawyer?,Bir avukata ihtiyacım var mı?
Do I need a reason?,Bir nedene ihtiyacım var mı?
Do I need dentures?,Protezlere ihtiyacım var mı?
Do I need stitches?,Dikişlere ihtiyacım var mı?
Do I need to go on?,Devam etmem gerekiyor mu?
Do I need to hurry?,Acele etmeme gerek var mı?
Do I owe you money?,Sana para borçlu muyum?
Do I smell cookies?,Kurabiye kokusu alıyor muyum?
Do I smell cookies?,Kurabiye kokusu mu alıyorum?
Do I sound in love?,Âşık gibi görünüyor muyum?
Do as he tells you.,Sana dediği gibi yap.
Do come if you can!,"Gelebiliyorsan, gel!"
Do it by all means.,Her ne şekilde olursa olsun onu yap.
Do it your own way.,Onu kendi tarzınla yap.
"Do like I said, OK?","Söylediğim gibi yap, tamam mı?"
Do like I tell you.,Sana söylediğim gibi yap.
Do not disturb her.,Onu rahatsız etmeyin.
Do they have money?,Onların parası var mı?
Do they sell books?,Onlar kitap satıyor mu?
Do they suspect me?,Onlar benden şüpheleniyor mu?
Do watch your step.,Adımına dikkat et.
Do we have to wait?,Beklemek zorunda mıyız?
Do what I tell you.,Sana söylediğim şeyi yap.
Do you accept Visa?,VISA kabul ediyor musunuz?
Do you accept tips?,İpuçları kabul ediyor musun?
Do you believe Tom?,Tom'a inanıyor musunuz?
Do you believe him?,Ona inanıyor musun?
Do you belong here?,Buraya mı aitsin?
Do you eat octopus?,Ahtapot yer misin?
Do you feel better?,Daha iyi hissediyor musun?
Do you feel guilty?,Suçlu hissediyor musun?
Do you feel guilty?,Kendini suçlu mu hissediyorsun?
Do you feel hungry?,Aç mısın?
Do you hate me yet?,Şimdi benden nefret ediyor musun?
Do you have a band?,Bir grubun var mı?
Do you have a bike?,Bisikletin var mı?
Do you have a bike?,Bisikletiniz var mı?
Do you have a blog?,Blog'un var mı?
Do you have a boat?,Bir teknen var mı?
Do you have a book?,Kitabın var mı?
Do you have a book?,Bir kitabın var mı?
Do you have a coin?,Bozuk paran var mı?
Do you have a comb?,Tarağın var mı?
Do you have a plan?,Bir planın var mı?
Do you have a wife?,Karın var mı?
Do you have any ID?,Kimliğin var mı?
Do you have apples?,Elmaların var mı?
Do you have change?,Bozuk paran var mı?
Do you have doubts?,Şüphelerin mi var?
Do you have enough?,Yeterince sahip misin?
Do you have it yet?,Henüz ona sahip misin?
Do you hear voices?,Sesler duyuyor musun?
Do you know French?,Fransızca biliyor musun?
Do you know kabuki?,Kabukiyi biliyor musunuz?
Do you know my son?,Oğlumu tanıyor musun?
Do you like Boston?,Boston'u seviyor musun?
Do you like French?,Fransızcayı seviyor musun?
Do you like Moscow?,Moskova'yı sever misin?
Do you like Mozart?,Mozart'ı sever misin?
Do you like Wagner?,Wagner'i sever misin?
Do you like apples?,Elma sever misiniz?
Do you like cheese?,Peynir sever misin?
Do you like cities?,Şehirleri sever misin?
Do you like coffee?,Kahveden hoşlanır mısın?
Do you like flying?,Uçmayı sever misin?
Do you like hiking?,Yürüyüşü sever misin?
Do you like horses?,Atları sever misin?
Do you like movies?,Filmleri sever misiniz?
Do you like robots?,Robotları sever misin?
Do you like salmon?,Somon sever misin?
Do you like school?,Okulu seviyor musun?
Do you like soccer?,Futbol sever misin?
Do you like sports?,Spor sever misiniz?
Do you like summer?,Yazı sever misin?
Do you like tennis?,Tenisi seviyor musun?
Do you like to run?,Koşmayı sever misin?
Do you live nearby?,Yakında mı yaşıyorsun?
