input_text,target_text
He has a good memory.,O iyi bir hafızaya sahiptir.
He has a hairy chest.,Onun tüylü bir göğsü var.
He has a hairy chest.,Onun kıllı bir göğsü var.
He has a hungry look.,O aç gibi görünüyor.
He has a large truck.,Onun büyük bir kamyonu var.
He has a lot of land.,Onun bir sürü arazisi var.
He has a mild nature.,Onun ılımlı bir doğası var.
He has a mild nature.,Yumuşak tabiatlı bir insandır.
He has a mild nature.,Yumuşak bir tabiatı vardır.
He has a nice income.,O iyi bir gelire sahip.
He has a nimble mind.,Onun çevik bir zekası var.
He has a small frame.,Onun küçük bir çerçevesi vardır.
He has a strong body.,O güçlü bir gövdeye sahip.
He has a strong body.,O güçlü bir vücuda sahip.
He has a strong mind.,Onun güçlü bir zihni vardır.
He has a strong will.,"O, güçlü bir iradeye sahiptir."
He has a sweet voice.,Onun tatlı bir sesi vardır.
He has already begun.,O zaten başladı.
He has been to India.,"O, Hindistan'da bulundu."
He has good eyesight.,O iyi görme duyusuna sahip.
He has lots of money.,O aşırı para harcıyor.
He has many troubles.,Onun pek çok sorunu var.
He has natural gifts.,Onun doğuştan yetenekleri var.
He has no conscience.,Onun hiç vicdanı yok.
He has no girlfriend.,Hiç kız arkadaşı yok.
He has nothing to do.,Onun yapacak bir şeyi yok.
He has poor eyesight.,Onun görme kabiliyeti kötü.
He has poor eyesight.,O kötü görme duyusuna sahip.
He has powerful arms.,Onun güçlü bir kolları var.
He has rough manners.,Onun kaba davranışları var.
He has sharp hearing.,Onun keskin bir işitmesi var.
He has strange ideas.,Onun tuhaf fikirleri var.
He has to study hard.,O çok çalışmak zorunda.
He has two daughters.,Onun iki kız çocuğu var.
He has two daughters.,İki kızı var.
He has very bad luck.,Onun çok kötü şansı var.
He hates her parents.,Ebeveynlerinden nefret eder.
He held out his hand.,"O, elini uzattı."
He held up his hands.,"O, ellerini kaldırdı."
He hit me by mistake.,O bana yanlışlıkla vurdu.
He hit me in the eye.,O benim gözüme vurdu.
He insulted our team.,Bizim takıma hakaret etti.
He is a Japanese boy.,O bir Japon çocuk.
He is a cheerful boy.,"O, neşeli bir çocuktur."
He is a cruel person.,"O, zalim bir kişidir."
He is a fast speaker.,O hızlı bir konuşucu.
He is a good athlete.,O iyi bir atlet.
He is a good speaker.,O iyi bir konuşmacı.
He is a good speaker.,O iyi bir spiker.
He is a good student.,O iyi bir öğrenci.
He is a good swimmer.,O iyi bir yüzücü.
He is a handsome man.,O yakışıklı bir adam.
He is a harsh critic.,O sert bir eleştirmen.
He is a lazy student.,O tembel bir öğrenci.
He is a man of faith.,O bir inanç insanıdır.
He is a tough cookie.,O bir çetin ceviz.
He is about to leave.,O gitmek üzere.
He is about your age.,O yaklaşık senin yaşında.
He is afraid of dogs.,"O, köpeklerden korkar."
He is afraid to swim.,O yüzmeye korkuyor.
He is always reading.,O her zaman okuyor.
He is always with me.,"O, her zaman benimledir."
He is an able banker.,O yetenekli bir bankacı.
He is an able lawyer.,"O, yetenekli bir avukattır."
He is an angry drunk.,O öfkeli bir sarhoş.
He is an unsung hero.,O duyulmamış bir kahraman.
He is angry with you.,O sana kızgın.
He is apt to be late.,O geç kalmaya eğilimli.
He is as tall as her.,"O, onun kadar uzun boylu."
He is away from home.,O evden uzakta.
He is bad at driving.,O araba sürmede kötüdür.
He is breathing hard.,"O, zor nefes alıyor."
He is close to sixty.,O altmışa yakın.
"He is cool, isn't he?","O, harika, değil mi?"
He is doing his work.,O işini yapıyor.
He is far from happy.,"O, hiç mutlu değildir."
He is five feet tall.,O beş fit boyunda.
He is free from care.,Onun hiçbir kaygısı yok.
He is friendly to me.,O bana karşı samimi.
He is full of energy.,O kişi çok enerjik.
He is full of energy.,O enerji doludur.
He is getting better.,O daha iyileşiyor.
He is good and drunk.,O iyi ve sarhoştur.
He is good at diving.,"O, dalmada iyidir."
He is good at soccer.,"O, futbolda iyi."
He is good at tennis.,O teniste iyidir.
He is good at tennis.,O iyi tenis oynar.
He is hard to please.,Onu memnun etmek zordur.
He is his own master.,O onun kendi ustası.
He is his usual self.,"O, onun her zamanki hali."
He is homeward bound.,O evine dönüyor.
He is in his library.,"O, kütüphanesindedir."
He is in poor health.,Onun sağlığı kötü.
He is in the kitchen.,"O, mutfakta."
He is in trouble now.,Şimdi onun başı belada.
He is lazy by nature.,"O, doğası gereği tembel."
He is likely to come.,O muhtemelen gelecektir.
He is making cookies.,O kurabiye yapıyor.
He is merely a child.,O sadece bir çocuk.
He is my best friend.,O benim en iyi arkadaşım.
He is no longer here.,O artık burada değil.
He is now on his own.,O şimdi kendi başına.
He is off duty today.,O bugün izinli.
He is precious to us.,O bizim için değerlidir.
He is quite a savage.,O oldukça vahşi.
He is reading a book.,O bir kitap okuyor.
He is sadly mistaken.,Ne yazık ki yanılmıştır.
He is second to none.,O hepsinden iyi.
He is small and weak.,"O, küçük ve güçsüz."
He is still standing.,Halen ayakta duruyor.
He is terribly funny.,O korkunç komik.
He is the chosen one.,O seçilmiş biridir.
He is very depressed.,O çok bunalımdaydı.
He is very sensitive.,O çok duyarlıdır.
He is wearing gloves.,"O, eldiven giyiyordu."
He is willing enough.,O yeterince istekli.
He is writing a book.,O bir kitap yazıyor.
He is young at heart.,O kalbinde genç.
He isn't an American.,O bir Amerikalı değildir.
"He isn't here, is he?","O burada değil, değil mi?"
He jumped out of bed.,O yataktan fırladı.
He keeps bad company.,Kötü eşlik eder.
He kissed her deeply.,Onu içtenlikle öptü.
He knew it all along.,"O, onu başından beri biliyordu."
He knows how to dive.,O dalmayı bilir.
He knows how to swim.,O yüzmeyi bilir.
He knows many people.,O birçok insan tanır.
He knows who you are.,O kim olduğunu bilir.
He laid down the gun.,O silahı yere bıraktı.
He laughed nervously.,O sinirli olarak güldü.
He leaned towards me.,O bana doğru eğildi.
He led a simple life.,O basit bir hayat sürdü.
He left a minute ago.,Bir dakika önce gitti.
He left his children.,"O, çocuklarını terk etti."
He left home at 8:00.,"O, saat 8:00 'de evden çıktı."
He lent me two books.,O bana iki kitap ödünç verdi.
He likes Indian food.,O Hint yemeklerini sever.
He likes Indian food.,Hint yemeklerini sever.
He likes music a lot.,O müzikten çok hoşlanır.
He likes this guitar.,O bu gitarı sever.
He likes to watch TV.,"O, TV izlemeyi sever."
He likes watching TV.,TV izlemeyi seviyor.
He lived a hard life.,"O, zor bir hayat yaşadı."
He lived a long life.,O uzun bir hayat yaşadı.
He lives comfortably.,O konfor içinde yaşamaktadır.
He lives in Nagasaki.,"O, Nagasaki'de yaşıyor."
He lives in Yokohama.,O Yokohama'da yaşamaktadır.
He lives like a king.,O bir kral gibi yaşar.
He lives there alone.,Orada yalnız yaşamaktadır.
He looked at the sky.,Gökyüzüne baktı.
He looked bewildered.,Şaşkın görünüyordu.
He looked tired then.,"O, o zaman yorgun görünüyordu."
He looked very happy.,O çok mutlu görünüyordu.
He looked very tired.,Çok yorgun görünüyordu.
He looks a bit tired.,"O, biraz yorgun görünüyor."
He looks a bit tired.,Biraz yorgun gözüküyor.
He looks like a girl.,O bir kıza benziyor.
He looks very sleepy.,"O, çok uykulu görünüyor."
He lost his eyesight.,"O, görme duyusunu kaybetti."
He lost his eyesight.,O görme yeteneğini kaybetti.
He made a rude reply.,"O, kaba bir yanıt verdi."
He made for the door.,Kapıya doğru yöneldi.
He made her his wife.,"O, onu eşi yaptı."
He made up an excuse.,O bir bahane uydurdu.
He made up the story.,"O, hikayeyi uydurdu."
He managed to escape.,O kaçmayı başardı.
He married for money.,O para için evlendi.
He married my cousin.,"O, benim kuzenimle evlendi."
He married my sister.,O benim kız kardeşim ile evlendi.
He may have been ill.,O hasta olmuş olabilir.
He may well be right.,O haklı olabilir.
He missed his flight.,"O, uçağını kaçırdı."
He misses his family.,Ailesini özlüyor.
He misses his father.,"O, babasını özlüyor."
He mocked my efforts.,Çabalarımla alay etti.
He must be around 40.,O 40 civarında olmalı.
He must have seen it.,Onu görmüş olmalı.
He needs an umbrella.,Onun bir şemsiyeye ihtiyacı var.
He needs to be alone.,Onun yalnız kalmaya ihtiyacı var.
He never looked back.,O asla arkasına bakmadı.
He never tells a lie.,"O, asla yalan söylemez."
He never told anyone.,O kimseye asla söylemedi.
He never wears a tie.,O asla kravat takmaz.
He often plays piano.,O sık sık piyano çalar.
He ordered us steaks.,O bize biftek ısmarladı.
He owns a dishwasher.,Onun bir bulaşık makinesi var.
He picked up a stone.,O bir taş aldı.
He pressed his pants.,O pantolonunun ütüledi.
He put away his toys.,"O, oyuncaklarını kaldırdı."
He raised a question.,O bir sorunu gündeme getirdi.
He ran at full speed.,O tam hızda koştu.
He ran away from her.,O ondan kaçtı.
He ran into the room.,"O, odasına koştu."
He ran outside naked.,O dışarıya çıplak koştu.
He ran up the stairs.,O merdivenleri çıktı.
He rang the doorbell.,"O, kapı zilini çaldı."
He rarely gets angry.,"O, nadiren sinirlenir."
He rarely went there.,"O, nadiren oraya giderdi."
He reads a good deal.,O oldukça çok okur.
He removed his shirt.,"O, gömleğini çıkardı."
He repaired the nets.,O ağlarını onardı.
He repeated it again.,"O, onu yine tekrarladı."
He returned to Japan.,"O, Japonya'ya geri döndü."
He ridiculed my idea.,O benim fikrimle alay etti.
He said he should go.,"O, gitmesi gerektiğini söyledi."
He said it as a joke.,O onu şaka olarak söyledi.
He sank into a chair.,"O, bir koltuğa gömüldü."
He saw a pretty girl.,O güzel bir kız gördü.
He says he will come.,O onun geleceğini söylüyor.
He screamed for help.,"O, yardım için çığlık attı."
He seems quite happy.,O oldukça mutlu görünüyor.
He seems to be happy.,"O, mutlu gibi görünüyor."
He seems to be lying.,O yalan söylüyor gibi görünüyor.
He seems to think so.,O öyle düşünüyor gibi görünüyor.
He seldom gets angry.,"O, nadiren sinirlenir."
He seldom went there.,"O, nadiren oraya giderdi."
He sent for a doctor.,O bir doktor çağırttı.
He sent me a present.,O bana bir hediye gönderdi.
He sent me a present.,O bana bir hediye yolladı.
He sent me a present.,Bana bir hediye göndermiş.
He set out for Tokyo.,Tokyo'ya seyahate gitti.
He set out on a trip.,O bir seyahata çıktı.
He shall be punished.,"O, cezalandırılacaktır."
He shall be punished.,O cezalandırılacaktır.
He showed me the way.,O bana yolu gösterdi.
He sketched an apple.,O bir elma çizdi.
He slipped me a note.,O bana gizlice bir not verdi.
He sold all his land.,O bütün arazisini sattı.
He speaks Portuguese.,O Portekizce konuşur.
He spoke very loudly.,Çok yüksek sesle konuştu.
He stole the diamond.,O elmas çaldı.
He studied very hard.,O çok çalıştı.
He studies very hard.,O çok fazla çalışır.
He suddenly fell ill.,Aniden hastalandı.
He swims like a fish.,O bir balık gibi yüzer.
He talked to himself.,O kendi kendine konuştu.
He talks to me a lot.,Benimle çok konuşur.
He taught me history.,"O, bana tarih öğretti."
He tells a good joke.,O iyi fıkra anlatır.
He thinks I love her.,O onu sevdiğimi düşünüyor.
He told her to study.,"O, ona çalışmasını söyledi."
He told him to study.,"O, ona çalışmasını söyledi."
He told me the truth.,Bana gerçeği söyledi.
He took it literally.,O kelimeyi bire bir çevirdi.
He took off his coat.,O paltosunu çıkardı.
He tore his ligament.,"O, bağ dokusunu yırttı."
He trained very hard.,O çok zor yetiştirdi.
He tried to stand up.,O ayağa kalkmaya çalıştı.
He turned the corner.,"O, köşeyi döndü."
He used to live here.,O burada yaşardı.
He used to love that.,O onu severdi.
He wanted to be rich.,"O, zengin olmak istiyordu."
He wanted to meet me.,O benimle tanışmak istedi.
He wanted to succeed.,O başarılı olmak istedi.
He wants red glasses.,O kırmızı gözlük istiyor.
He wants to kiss her.,O onu öpmek istiyor.
He wants to meet you.,O seninle tanışmak istiyor.
He was a good friend.,O iyi bir arkadaştı.
He was almost asleep.,Neredeyse uyuyordu.
He was an honest man.,O dürüst bir adamdı.
He was badly wounded.,O kötü bir şekilde yaralandı.
He was drunk on beer.,"O, biradan sarhoş oldu."
He was elected mayor.,"O, belediye başkanı seçildi."
He was in the shower.,"O, duştaydı."
He was made to do so.,Ona öyle yaptırıldı.
He was not impressed.,O etkilenmedi.
He was out of breath.,"O, nefes nefese idi."
He was put in a cell.,O bir hücreye konuldu.
He was put in prison.,O hapseneye atıldı.
He was shot to death.,O vurularak öldürüldü.
He was sitting there.,O orada oturuyordu.
He was wearing a tux.,O bir smokin giyiyordu.
He wasn't even there.,O orada bile değildi.
He wears an eyepatch.,O bir göz bandı takar.
He weighs 270 pounds.,"O, 270 paund ağırlığındadır."
He went deer hunting.,O geyik avına gitti.
He went duck hunting.,"O, ördek avına gitti."
He went to bed early.,"O, yatmaya erken gitti."
He went to the store.,"O, mağazaya gitti."
He will be back soon.,Yakında geri dönecek.
He will be here soon.,O birazdan burada olacak.
He will not be ready.,Hazır olmayacak.
He will study French.,"O, Fransızca çalışacak."
He won her affection.,O onun sevgisini kazandı.
He works as a busboy.,"O, bir komi olarak çalışmaktadır."
He works at the bank.,O bir bankada çalışır.
He works at the bank.,O bankada çalışır.
He works in that lab.,"O, o laboratuvarda çalışmaktadır."
He works us too hard.,O bizi çok sıkı çalıştırıyor.
He would not approve.,O kabul etmedi.
He wrote me a letter.,Bana bir mektup yazdı.
He's a bad influence.,Onun kötü bir etkisi var.
He's a bit energetic.,O biraz enerjik.
He's a computer nerd.,O bir bilgisayar delisi.
He's a famous artist.,O ünlü bir sanatçı.
He's a fishing guide.,O bir balıkçı kılavuzudur.
He's a heavy drinker.,O bir alkolik.
He's a hopeless case.,O umutsuz bir vaka.
He's a nervous wreck.,O çok fazla gergin.
He's a smooth talker.,O düzgün konuşur.
He's a tennis player.,O bir tenis oyuncusu.
He's a very nice boy.,O çok hoş bir çocuk.
He's afraid to dance.,O dans etmekten korkuyor.
He's already married.,O zaten evli.
He's also a salesman.,O da bir satıcı.
He's always scowling.,O her zaman kaşlarını çatıyor.
He's bound to forget.,O unutmaya mecbur.
He's crazy about her.,O ona deli gibi âşık.
He's crazy about you.,"O, senin için deli oluyor."
He's eating an apple.,O bir elma yiyor.
He's eight years old.,O sekiz yaşında.
He's extremely happy.,O son derece mutlu.
He's got a white cat.,Onun beyaz bir kedisi var.
He's got lung cancer.,Onun akciğer kanseri var.
He's greedy and lazy.,O aç gözlü ve tembel.
He's in grave danger.,O büyük tehlikede.
He's in the bathroom.,"O, banyoda."
He's in the hospital.,"O, hastanededir."
He's just an amateur.,O sadece bir amatör.
He's mad at everyone.,O herkese kızgın.
He's making progress.,O ilerleme kaydediyor.
He's missed the boat.,"O, fırsatı kaçırdı."
He's my half-brother.,O benim üvey erkek kardeşim.
He's never satisfied.,O asla tatmin olmaz.
He's not in the mood.,O havasında değil.
He's now on the boat.,O şimdi teknede.
He's offered to help.,O yardım etmeyi önerdi.
He's on his way home.,"O, eve gidiyor."
He's one of the best.,O en iyilerden biri.
He's out for the day.,O gün boyu dışarıdadır.
He's out of position.,O yerinde değil.
He's putting on airs.,O fiyaka yapıyor.
He's putting on airs.,O hava atıyor.
He's right behind me.,O tam benim arkamda.
He's taking a shower.,O duş alıyor.
He's the class clown.,Sınıfın şaklabanı.
He's too old for her.,O onun için çok yaşlı.
He's too old for you.,O senin için çok yaşlı.
He's totally lost it.,O delirdi.
He's under the chair.,"O, sandalyenin altında."
He's under treatment.,O tedavi oluyor.
He's up to something.,O bir dolap çeviriyor.
He's up to something.,O bir şeyin peşinde.
He's up to something.,O bir işin peşinde.
He's very kind to me.,"O, bana karşı çok nazik."
He's very protective.,O çok koruyucu.
He's younger than me.,O benden daha genç.
Health is all I want.,Tüm istediğim sağlıktır.
Help finally arrived.,Yardım nihayet geldi.
Help him with French.,Ona Fransızcada yardım et.
Her daughter is sick.,Onun kızı hasta.
Her face turned pale.,Onun yüzü soldu.
Her hat looked funny.,Şapkası komik görünüyordu.
Her mind is at peace.,Zihni barış içinde.
Her name was unknown.,Onun adı bilinmiyordu.
Her nose is bleeding.,Onun burnu kanıyor.
Her parents loved me.,Onun ailesi beni sevdi.
Here are some idioms.,İşte bazı deyimler.
Here are the choices.,İşte seçimler.
Here are the details.,İşte ayrıntılar.
Here are the results.,İşte sonuçlar.
Here are the tickets.,İşte biletler.
Here are their books.,İşte onların kitapları.
Here comes the enemy.,İşte düşman geliyor.
Here comes the train!,İşte tren geliyor!
Here comes the train.,İşte tren geliyor.
Here is your receipt.,Buyurun fişiniz.
Here's Tom's picture.,İşte Tom'un resmi.
Here's a better idea.,İşte daha iyi bir fikir.
Here's a yellow rose.,İşte sarı bir gül.
Here's how to use it.,İşte onu nasıl kullanacağınız.
Here's some more tea.,İşte biraz daha çay.
Here's the best part.,İşte en iyi parça.
Here's the wine list.,İşte şarap listesi.
Here's what we found.,İşte bulduğumuz şey.
Here's your paycheck.,İşte maaş çekin.
Here's your room key.,İşte odanın anahtarı.
"Here's your tea, Tom.","İşte çayınız, Tom."
Here's your umbrella.,İşte senin şemsiyen.
"Here, take my jacket.","İşte, ceketimi al."
Hey you! Please wait.,Hey siz! Lütfen bekleyin.
"Hey, I can handle it.","Hey, onunla başa çıkabilirim."
"Hey, can I have that?","Hey, onu alabilir miyim?"
"Hey, did you hear me?","Hey, beni duydun mu?"
"Hey, get off my bike.","Hey, bisikletimden in."
"Hey, give me a break.",Hey bana bir mola verin.
"Hey, guys. What's up?","Hey, arkadaşlar. Ne haber?"
"Hey, it's not so bad.","Hey, bu çok kötü değil."
"Hey, it's still warm.","Hey, hava hâlâ sıcak."
"Hey, let me help you.","Hey, sana yardım edeyim."
"Hey, look over there.","Hey, oraya bak."
"Hey, look what I got.","Hey, bak bende ne var."
"Hey, this is working.","Hey, bu işe yarıyor."
"Hey, what's going on?","Hey, nasıl gidiyor?"
"Hey, what's so funny?","Hey, bu kadar komik olan ne?"
"Hey, what's the deal?","Hey, anlaşma ne?"
"Hey, who wants pizza?","Hey, kim pizza istiyor?"
Hey. That's not fair.,Selam. O adil değil.
Hey. What's going on?,Merhaba. Neler oluyor?
"Hi everyone, I'm Tom.","Herkese selam, Ben Tom."
Hi! Do you work here?,Merhaba! Burada mı çalışıyorsunuz?
"Hi, how're you doing?","Merhaba, ne yapıyorsun?"
His aunt looks young.,Onun teyzesi genç görünüyor.
His blood is boiling.,Onun kanı kaynıyor.
His book inspired me.,Kitabı bana ilham verdi.
His daughter is sick.,Onun kızı hasta.
His essay is rubbish.,Onun denemesi saçmalık.
His face turned pale.,Onun yüzü soldu.
His feet were asleep.,Onun ayakları uyuşmuştu.
His hands feel rough.,Onun elleri kabadır.
His hands were empty.,Onun elleri boştu.
His memory amazes me.,Onun hafızası beni şaşırtıyor.
His mother was right.,Annesi haklıydı.
His nose is bleeding.,Onun burnu kanıyor.
His nose is bleeding.,Burnu kanıyor.
His parents hate him.,Onun ebeveynleri ondan nefret eder.
His parents loved me.,Onun ebeveynleri beni sevdi.
His parents loved me.,Onun anne babası beni sevdi.
His socks are purple.,Onun çorapları mor.
His teeth were white.,Onun dişleri beyazdı.
Hold it for a second.,Bunu bir saniye tut.
Hold on for a second.,Bir saniye bekle.
Hold perfectly still.,Tamamen kıpırdama.
"Hopefully, we'll win.",İnşallah kazanacağız.
How about a sandwich?,Bir sandviçe ne dersin?
How about your place?,Ya sizin yerinizi nasıl?
How am I still alive?,Nasıl hâlâ hayattayım?
How are Tom and Mary?,Tom ve Mary nasıllar?
How are Tom and Mary?,Tom ve Mary nasıl?
How are noodles made?,Erişte nasıl yapılır?
How are the children?,Çocuklar nasıl?
How are things going?,İşler nasıl gidiyor?
How are you managing?,Nasıl yönetiyorsun?
How are your parents?,Ebeveynlerin nasıl?
How bad can this get?,Ne kadar kötüleşebilir?
How bad is it really?,Gerçekten ne kadar kötü?
How bad was Tom hurt?,Tom ne kadar kötü incindi?
How bad was Tom hurt?,Tom ne kadar kötü incinmişti?
How beautiful she is!,O ne kadar güzel.
How big is this park?,Bu park ne kadar büyük?
How big is this town?,Bu şehir ne kadar büyük?
How big is your room?,Odanız ne kadar büyüktür?
How big is your room?,Odan ne kadar büyük?
How big is your yard?,Bahçen ne kadar büyük?
How can I be helpful?,Nasıl yardımcı olabilirim?
How can I be of help?,Nasıl yardımcı olabilirim.
How can I call a cab?,Nasıl taksi çağırabilirim?
How can I pay for it?,Onu nasıl ödeyebilirim.
How can I refuse you?,Sizi nasıl reddedebilirim?
How can I refuse you?,Seni nasıl reddedebilirim?
How can they do that?,Onu nasıl yapabiliyorlar?
How can they do that?,Onlar onu nasıl yapabilir?
How can they do this?,Onlar bunu nasıl yapabilirler?
How can they stop us?,Onlar bizi nasıl durdurabilir?
How can this be done?,Bu nasıl yapılabilir?
How can this be real?,Bu nasıl gerçek olabilir?
How can this be true?,Bu nasıl doğru olabilir?
How can we do better?,Nasıl daha iyi yapabiliriz.
How can we kill time?,Nasıl zaman geçirebiliriz?
How can we stop them?,Onları nasıl durdurabiliriz?
How can we thank you?,Size nasıl teşekkür edebiliriz?
How can we thank you?,Sana nasıl teşekkür edebiliriz?
How can you eat that?,Nasıl yiyebilirsin bunu?
How can you help Tom?,Tom'a nasıl yardım edebilirsin?
How can you not know?,Nasıl bilemezsin?
How can you say that?,Onu nasıl söyleyebilirsin?
How can you stand it?,Ona nasıl dayanabiliyorsun?
How cold is too cold?,Ne kadar soğuk çok soğuktur?
How cold will it get?,Ne kadar soğuk olacak?
How could I hate Tom?,Tom'dan nasıl nefret edebilirim?
How could I help you?,Size nasıl yardım edebilirim?
How could Tom say no?,Tom nasıl hayır diyebilir?
How could we do that?,Onu nasıl yapabiliriz?
How could we not win?,Nasıl kazanamadık?
How dangerous is Tom?,Tom ne kadar tehlikeli?
How dare you defy me!,Beni küçümsemeye nasıl cüret edersin!
How dare you do this!,Bunu yapmaya nasıl cüret edersin!
How deep is the hole?,Delik ne kadar derin?
How deep is the lake?,Göl ne kadar derin?
How deep is too deep?,Ne kadar derin çok derin?
How did Tom find out?,Tom nasıl keşfetti?
How did Tom find you?,Tom seni nasıl buldu?
How did Tom get away?,Tom nasıl kaçtı?
How did Tom get here?,Tom buraya nasıl geldi?
How did Tom get home?,Tom eve nasıl gitti?
How did Tom get hurt?,Tom nasıl incindi?
How did Tom get rich?,Tom nasıl zengin oldu?
How did he come here?,O buraya nasıl geldi?
How did it all begin?,Bunun hepsi nasıl başladı?
How did it get there?,Bu oraya nasıl geldi?
How did that develop?,O nasıl gelişti?
How did the party go?,Parti nasıl gitti?
How did they do that?,Onlar onu nasıl yaptı?
How did they do this?,Onlar bunu nasıl yaptı?
How did they stop it?,Onlar bunu nasıl durdurdu?
How did we come here?,Buraya nasıl geldik?
How did you break it?,Bunu nasıl kırdın?
How did you find Tom?,Tom'u nasıl buldun?
How did you find out?,Sen nasıl öğrendin?
How did you get here?,Buraya nasıl geldin?
How did you get hurt?,Nasıl yaralandın?
How did you get that?,Onu nasıl aldın?
How did you get them?,Onları nasıl aldın?
How did you get this?,Bunu nasıl aldın?
How did you help Tom?,Tom'a nasıl yardım ettin?
How did you kill Tom?,Tom'u nasıl öldürdün?
How did you make out?,Nasıl fark ettin?
How did you meet Tom?,Tom'la nasıl tanıştınız?
How did you meet him?,Onunla nasıl tanıştın?
How did you see that?,Onu nasıl gördün?
How did you two meet?,Siz ikiniz nasıl tanıştınız?
How did your date go?,Randevun nasıl geçti?
How did your test go?,Testin nasıl gitti?
How different is Tom?,Tom ne kadar farklı?
How do I gain weight?,Nasıl kilo alırım?
How do I open a file?,Dosyayı nasıl açarım?
How do parents do it?,Ebeveynler bunu nasıl yapar?
How do we pay for it?,Bunu nasıl öderiz?
"How do you feel, Tom?","Nasıl hissediyorsun, Tom?"
How do you know that?,Onu nasıl biliyorsun?
How do you know this?,Bunu nereden biliyorsun?
How do you like that?,Onun hakkında ne düşünüyorsun?
How do you like that?,Şunu nasıl buluyorsun?
How do you make that?,Onu nasıl yaparsınız?
How do you stop this?,Bunu nasıl durdurursun?
How do you want them?,Onları nasıl istiyorsunuz?
How does Tom do that?,Tom onu nasıl yapıyor?
How does Tom do this?,Tom bunu nasıl yapar?
How does that happen?,Bu nasıl olur?
How does the song go?,Şarkı nasıl gidiyor?
How does this happen?,Bu nasıl olur?
How far are we going?,Ne kadar uzağa gidiyoruz?
How far would Tom go?,Tom ne kadar uzağa giderdi?
How fast can you run?,Ne kadar hızlı koşabilirsin?
How fast did Tom run?,Tom ne kadar hızlı koştu?
How fast does he run?,O ne kadar hızlı çalışır?
How fast is too fast?,Ne kadar hızlı çok hızlı?
How flexible are you?,Ne kadar esneksin?
How hard can that be?,O ne kadar zor olabilir?
How hard can this be?,Bu ne kadar zor olabilir?
How hard could it be?,Bu ne kadar zor olabilir?
How high is Mt. Fuji?,Fuji Dağı'nın yüksekliği nedir?
How important is Tom?,Tom ne kadar önemli?
How is Tom different?,Tom nasıl farklı?
How is Tom doing now?,Tom şimdi nasıl?
How is that my fault?,O nasıl benim hatam olabilir?
How is that possible?,O nasıl mümkün olabilir?
