input_text,target_text
I have a telephone.,Bir telefonum var.
I have a telescope.,Bir teleskobum var.
I have a toothache.,Dişim ağrıyor.
I have a tough job.,Zor bir işim var.
I have a white cat.,Beyaz bir kedim var.
I have an easy job.,Kolay bir işim var.
I have an overbite.,Diş fırlaklığım var.
I have another job.,Başka bir işim var.
I have been abroad.,Yurt dışındaydım.
I have blonde hair.,Benim sarı saçım var.
I have cabin fever.,Kapalı yer korkum var.
I have cabin fever.,Bir mekanda uzun süre kalma korkum var.
I have enough time.,Yeterli vaktim var.
I have few friends.,Az sayıda arkadaşım var.
I have few friends.,Birkaç arkadaşım var.
I have found a job.,Bir iş buldum.
I have frizzy hair.,Arap saçı gibi saçım var.
I have frizzy hair.,Kıvır kıvır saçım var.
I have greasy skin.,Yağlı bir cildim var.
I have information.,Bilgim var.
I have lost my cap.,Benim kepimi kaybettim.
I have lost my key.,Benim anahtarımı kaybettim.
I have lost my pen.,Dolma kalemimi kaybettim.
I have lung cancer.,Akciğer kanserim var.
I have many dreams.,Benim birçok hayallerim var.
I have many photos.,Bir sürü fotoğrafım var.
I have more to say.,Söyleyecek daha çok şeyim var.
I have my passport.,Benim pasaportum var.
I have no appetite.,Hiç iştahım yok.
I have no children.,Hiç çocuğum yok.
I have no idea why.,Sebebi hakkında fikrim yok.
I have no patience.,Benim sabrım yok.
I have no religion.,Dinsizim.
I have no religion.,Benim hiçbir dinim yok.
I have no siblings.,Hiç kardeşim yok.
I have one brother.,Bir erkek kardeşim var.
I have one request.,Benim bir ricam var.
I have one to sell.,Satmak için bir taneye sahibim.
I have one with me.,Yanımda bir tane var.
I have other plans.,Başka planlarım var.
I have seen enough.,Yeterince gördüm.
I have small hands.,Küçük ellerim var.
I have the day off.,İşten bir gün izin aldım.
I have the invoice.,Benim faturam var.
I have the measles.,Kızamıklarım var.
I have the tickets.,Biletlerim var.
I have to add this.,Bunu eklemek zorundayım
I have to be there.,Orada olmak zorundayım.
I have to call Tom.,Tom'u aramalıyım.
I have to disagree.,Ben katılmamak zorundayım.
I have to dress up.,Giyinmek zorundayım.
"I have to eat, too.",Ben de yemek zorundayım.
I have to exercise.,Egzersiz yapmalıyım.
I have to find Tom.,Tom'u bulmalıyım.
I have to fire Tom.,Tom'u işten atmalıyım.
I have to fix this.,Bunu onarmalıyım.
I have to get home.,Eve ulaşmalıyım.
I have to get that.,Onu almalıyım.
I have to go alone.,Yalnız gitmek zorundayım.
I have to go first.,Önce ben gitmek zorundayım.
I have to go there.,Oraya gitmeliyim.
I have to help Tom.,Tom'a yardım etmeliyim.
I have to know now.,Şimdi bilmek zorundayım.
I have to know why.,Sebebi bilmek zorundayım.
I have to meet Tom.,Tom'u karşılamalıyım.
I have to meet him.,Onunla buluşmalıyım.
I have to paint it.,Onu boyamak zorundayım.
I have to rehearse.,Prova yapmak zorundayım.
I have to run away.,Kaçmak zorundayım.
I have to say this.,Bunu söylemek zorundayım.
I have to see this.,Bunu anlamalıyım.
I have to see this.,Bunu görmeliyim.
I have to sit down.,Oturmalıyım.
I have to sit down.,Oturmak zorundayım.
I have to stop Tom.,Tom'u durdurmalıyım.
I have to take off.,Elbisemi çıkarmalıyım.
I have to take off.,Havalanmak zorundayım.
I have to tell Tom.,Tom'a söylemeliyim.
I have to warn Tom.,Tom'u uyarmak zorundayım.
I have to warn him.,Onu uyarmalıyım.
I have to work now.,Şimdi çalışmam gerekiyor.
I have two cameras.,İki kameram var.
I have two cousins.,İki kuzenim var.
I have two nephews.,İki yeğenim var.
I have two tickets.,İki biletim var.
I have what I need.,İhtiyacım olana sahibim.
I have what I want.,İstediğime sahibim.
I have your number.,Numaran bende var.
I have your number.,Numarana sahibim.
I haven't given up.,Vazgeçmedim.
I haven't had time.,Zamanım yoktu.
I haven't paid Tom.,Tom'a para ödemedim.
I haven't paid yet.,Ben henüz ödeme yapmadım.
I haven't seen Tom.,Tom'u görmedim.
I haven't told Tom.,Tom'a söylemedim.
I headed back home.,Eve geri döndüm.
I hear Tom is sick.,Tom'un hasta olduğunu duyuyorum.
I hear Tom's voice.,Tom'un sesini duyuyorum.
I hear you retired.,Emekli olduğunu duydum.
I hear you're rich.,Zengin olduğunu duyuyorum.
I heard Tom scream.,Tom'un çığlık attığını duydum.
I heard about that.,Onun hakkında duydum.
I heard every word.,Her sözü duydum.
I heard everything.,Her şeyi duydum.
I heard explosions.,Patlamalar duydum.
I heard him go out.,Onun dışarı çıktığını duydum.
I heard some shots.,Bazı silah sesleri duydum.
I heard that story.,O hikayeyi duydum.
I heard the report.,Raporu duydum.
I heard you crying.,Ağladığını duydum.
I heard you scream.,Çığlık attığını duydum.
I help you do that.,Ben bunu yapmana yardım ederim.
I helped Tom a lot.,Ben Tom'a çok yardım ettim.
I helped everybody.,Herkese yardım ettim.
I hid in the attic.,Tavan arasında saklandım.
I hid it somewhere.,Onu bir yere gizledim.
I hit a curve ball.,Yüreğim ağzıma geldi.
I hope I'll fit in.,İçeri gireceğimi umuyorum.
I hope Tom does OK.,Umarım Tom iyidir.
I hope Tom does it.,Onu Tom'un yaptığını umuyorum.
I hope Tom has fun.,Umarım Tom eğlenir.
I hope Tom is safe.,Umarım Tom güvendedir.
I hope Tom is well.,Tom'un iyi olduğunu umuyorum.
I hope Tom resigns.,Umarım Tom istifa eder.
I hope Tom says no.,Tom'un hayır diyeceğini umuyorum.
I hope Tom's right.,Tom'un haklı olduğunu umuyorum.
I hope Tom's right.,Umarım Tom haklıdır.
I hope Tom's wrong.,Umarım Tom hatalıdır.
I hope it pans out.,Onun başarıya ulaşacağını umuyorum.
I hope it's enough.,Umarım o yeterlidir.
I hope it's useful.,Umarım yararlıdır.
I hope that helped.,Onun yardımcı olduğunu umuyorum.
I hope that's true.,Onun doğru olduğunu umuyorum.
I hope to be there.,Orada olmayı umuyorum.
I hope to see them.,Onları görmeyi umuyorum.
I hope we beat Tom.,Tom'u yeneceğimizi umuyorum.
I hope we can help.,Umarım yardım edebiliyoruz.
I hope we find Tom.,Tom'u bulacağımızı umuyorum.
I hope you approve.,Umarım kabul edersin.
I hope you do fine.,İyi yapacağını umuyorum.
I hope you do that.,Umarım bunu yaparsın.
I hope you do well.,Umarım iyi yaparsın.
I hope you like it.,Ondan hoşlanacağını umuyorum.
I hope you like me.,Umarım beni seversin.
I hope you'll come.,Umarım geleceksin.
I hope you're well.,Umarım iyisindir.
I hurt my left arm.,Sol kolumu incittim.
I hurt my shoulder.,Omzumu incittim.
I intend to use it.,Onu kullanmayı istiyorum.
I invited Tom over.,Tom'u davet ettim.
I jog twice a week.,Ben haftada iki kez koşarım.
I just arrived now.,Ben henüz şimdi geldim.
I just borrowed it.,Onu sadece ödünç aldım.
I just borrowed it.,Onu az önce ödünç aldım.
I just bought that.,Ben sadece bunu aldım.
I just bought this.,Ben sadece bunu aldım.
I just can't do it.,Sadece onu yapamam.
I just can't sleep.,Sadece uyuyamıyorum.
I just emailed you.,Az önce sana e-posta attım.
I just got a raise.,Az önce bir zam aldım.
I just got an idea.,Az önce bir fikir aldım.
I just got engaged.,Az önce nişanlandım.
I just got evicted.,Yeni tahliye oldum.
I just got married.,Az önce evlendim.
I just kept silent.,Sadece sessiz kaldım.
I just kissed Mary.,Ben az önce Mary'yi öptüm.
I just lost my job.,İşimi yeni kaybettim.
I just lost my job.,Yalnızca işimi kaybettim.
I just made dinner.,Ben az önce akşam yemeği yaptım.
I just redecorated.,Az önce yeniden dekore ettim.
I just saw a ghost.,Ben az önce bir hayalet gördüm.
I just sold my car.,Arabamı yeni sattım.
I just took a bath.,Sadece bir banyo yaptım.
I just want to cry.,Ağlamak istiyorum.
I just want to die.,Sadece ölmek istiyorum.
I just want to win.,Sadece kazanmak istiyorum.
I just wanted cash.,Sadece nakit istedim.
I kept it a secret.,Bunu bir sır olarak sakladım.
I kept it a secret.,Onu bir sır olarak sakladım.
I kept my promises.,Ben sözlerimi tuttum.
I killed them both.,Onların ikisini de öldürdüm.
I kind of like Tom.,Tom'u az çok seviyorum.
I kind of like you.,Senden az çok hoşlanıyorum.
I kind of liked it.,Ben onu biraz sevdim.
I kind of miss Tom.,Tom'u biraz özlüyorum.
I kind of miss you.,Ben seni biraz özlüyorum.
I kissed Tom again.,Tom'u tekrar öptüm.
I knew I could win.,Kazanabileceğimi biliyordum.
I knew I was right.,Haklı olduğumu biliyordum.
I knew I would win.,Ben kazanacağımı biliyordum.
I knew Tom was shy.,Tom'un utangaç olduğunu biliyordum.
I knew how to swim.,Nasıl yüzeceğimi biliyordum.
I knew it was real.,Ben onun gerçek olduğunu biliyordum.
I knew what it was.,Onun ne olduğunu biliyordum.
I knew where to go.,Nereye gideceğimi biliyordum.
I knew you were OK.,İyi olduğunu biliyordum.
I knew your father.,Babanı tanırdım.
I know Boston well.,Boston'u iyi bilirim.
I know I can do it.,Bunu yapabileceğimi biliyorum.
I know I can't win.,Ben kazanamayacağımı biliyorum.
I know I need help.,Yardıma ihtiyacım olduğunu biliyorum.
I know I packed it.,Ben onu ambalajladığımı bilirim.
I know Tom cheated.,Tom'un aldattığını biliyorum.
I know Tom is busy.,Tom'un meşgul olduğunu biliyorum.
I know Tom is fine.,Tom'un iyi olduğunu biliyorum.
I know Tom is hurt.,Tom'un zarar gördüğünü biliyorum.
I know Tom's upset.,Tom'un üzgün olduğunu biliyorum.
I know Tom's widow.,Tom'un dul eşini tanıyorum.
I know all of them.,Onların hepsini tanıyorum.
I know her address.,Onu adresini biliyorum.
I know her address.,Kendisinin adresini biliyorum.
I know her by name.,Ben ona adıyla biliyorum.
I know him by name.,Ben onu ismen tanıyorum.
I know his address.,Onun adresini biliyorum.
I know his address.,Kendisinin adresini biliyorum.
I know how it ends.,Bunun nasıl sona erdiğini biliyorum.
I know how to dive.,Nasıl dalacağımı biliyorum.
I know how to swim.,Ben yüzmeyi biliyorum.
I know it by heart.,Onu çok iyi biliyorum.
I know it for sure.,Bunu kesinlikle biliyorum.
I know it's a mess.,Bunun bir karmaşa olduğunu biliyorum.
I know it's coming.,Onun geldiğini biliyorum.
I know my business.,Ben işimi biliyorum.
I know my daughter.,Kızımı biliyorum.
I know nothing yet.,Henüz bir şey bilmiyorum.
I know some French.,Biraz Fransızca biliyorum.
I know that's true.,Onun doğru olduğunu biliyorum.
I know the feeling.,Ben duyguyu biliyorum.
I know the problem.,Ben sorunu biliyorum.
I know those girls.,Şu kızları tanıyorum.
I know those rules.,Bu kuralları biliyorum.
I know those women.,Ben bu kadınları tanıyorum.
I know what I feel.,Ne hissettiğimi biliyorum.
I know what I felt.,Ne hissettiğimi biliyorum.
I know what I know.,Ne bildiğimi biliyorum.
I know what I like.,Ben neyi sevdiğimi biliyorum.
I know what I need.,Neye ihtiyacım olduğunu biliyorum.
I know what I said.,Ne dediğimi biliyorum.
I know what I want.,Ne istediğimi biliyorum.
I know what I'd do.,Ne yapacağımı biliyorum.
I know what he did.,Onun ne yaptığını biliyorum.
I know what it was.,Onun ne olduğunu biliyorum.
I know what to say.,Ne söyleyeceğimi biliyorum.
I know what you do.,Ne yaptığını biliyorum.
I know what's good.,Neyin iyi olduğunu biliyorum.
I know where he is.,Onun nerede olduğunu biliyorum.
I know where it is.,Onun nerede olduğunu biliyorum.
I know where to go.,Nereye gideceğimi biliyorum.
I know who that is.,Onun kim olduğunu biliyorum.
I know who you are.,Kim olduğunu biliyorum.
I know why that is.,Onun neden olduğunu biliyorum.
I know you hate it.,Bundan nefret ettiğini biliyorum.
I know you like me.,Beni sevdiğini biliyorum.
I know you love me.,Beni sevdiğini biliyorum.
I know you're busy.,Meşgul olduğunu biliyorum.
I know you're here.,Burada olduğunu biliyorum.
I know you're hurt.,Yaralı olduğunu biliyorum.
I know you're near.,Yakında olduğunu biliyorum.
I know your father.,Ben senin babanı biliyorum.
I know your father.,Senin babanı biliyorum.
I know your father.,Babanı tanıyorum.
I know your father.,Babanızı tanıyorum.
I know your father.,Senin babanı tanıyorum.
I know your father.,Sizin babanızı tanıyorum.
I know your father.,Ben senin babanı tanıyorum.
I know your father.,Ben sizin babanızı tanıyorum.
I know your mother.,Anneni tanıyorum.
I know your sister.,Kız kardeşini tanıyorum.
I lack imagination.,Ben hayal gücünden yoksunum.
I laughed out loud.,Yüksek sesle güldüm.
I lay awake in bed.,Ben yatakta uyanık yatıyorum.
I lay down to rest.,Dinlenmek için uzandım.
I lead a busy life.,Ben meşgul bir hayat sürdürüyorum.
I leave in an hour.,Bir saat içinde gideceğim.
I led that mission.,Bu görevi yönettim.
I left Tom at home.,Tom'u evde bıraktım.
I left Tom in 2013.,2013'te Tom'dan ayrıldım.
I left around 2:30.,2.30 civarında ayrıldım.
I left at midnight.,Gece yarısı ayrıldım.
I left it unlocked.,Ben onu kilitlemeden bıraktım.
I left my bag here.,Çantamı burada bıraktım.
I left the country.,Ülkeden ayrıldım.
I left without Tom.,Tom olmadan ayrıldım.
I let Tom catch me.,Tom'un beni yakalamasına izin verdim.
I let Tom sleep in.,Tom'un içeride uyumasına izin verdim.
I let you catch me.,Beni yakalamana izin verdim.
I licked the spoon.,Kaşığı yaladım.
I lied to the cops.,Polislere yalan söyledim.
"I like Boston, too.",Ben de Boston'u beğenirim.
I like Indian food.,Ben Hint yemeklerini severim.
I like Irish music.,Ben İrlanda müziğini beğeniyorum.
I like Korean food.,Ben Kore yemeğini severim.
I like L.A. better.,Ben L.A.'yı daha çok seviyorum.
I like Tom already.,Tom'u zaten seviyorum.
I like Tom's jokes.,Tom'un şakaları severim.
I like Tom's laugh.,Tom'un kahkahasını seviyorum.
I like Tom's style.,Tom'un tarzını seviyorum.
I like a challenge.,Meydan okumayı severim.
I like all of them.,Ben onların hepsini seviyorum.
I like apples best.,Ben ençok elmaları severim.
I like autumn best.,Ben en çok sonbaharı severim.
I like being alone.,Tek başıma olmayı seviyorum.
I like busy places.,Ben meşgul yerleri seviyorum.
I like busy places.,İşlek yerleri severim.
I like butterflies.,Kelebekleri severim
I like clean jokes.,Dürüst esprileri severim.
I like comic books.,Çizgi romanları severim.
I like disco music.,Ben disko müziği severim.
I like eating cake.,Ben pasta yemeği severim.
I like fish sticks.,Balık kroketlerini seviyorum.
I like good coffee.,Güzel kahveyi severim.
I like horse races.,Ben at yarışlarını severim.
I like hugging Tom.,Ben Tom'a sarılmayı seviyorum.
I like it that way.,Bunu o şekilde seviyorum.
I like it this way.,Ben onu bu şekilde severim.
I like living here.,Burada yaşamayı seviyorum.
I like music a lot.,Müziği çok severim.
I like my teachers.,Öğretmenlerimi seviyorum.
I like our chances.,Şanslarımızı seviyorum.
I like raspberries.,Ahududuyu severim.
I like short poems.,Kısa şiirleri severim.
"I like skiing, too.",Ben de kayak yapmayı seviyorum.
I like small towns.,Küçük kasabaları severim.
I like soccer best.,En çok futbolu severim.
I like that answer.,O cevabı seviyorum.
I like that person.,O kişiden hoşlanırım.
I like that statue.,O heykeli seviyorum.
I like the teacher.,Öğretmeni seviyorum.
I like their house.,Onların evini seviyorum.
I like this answer.,Bu cevabı beğeniyorum.
I like this custom.,Bu geleneği seviyorum.
I like this guitar.,Bu gitarı beğeniyorum.
I like this jacket.,Bu ceketi seviyorum.
I like this office.,Bu ofisi seviyorum.
I like this saying.,Bu deyişi seviyorum.
I like this school.,Bu okuldan hoşlanırım.
I like this season.,Bu sezondan hoşlanıyorum.
I like to barbecue.,Mangal yapmak hoşuma gidiyor.
I like to be alone.,Yalnız olmayı severim.
I like to be early.,Erken gelmeyi seviyorum.
I like to eat fish.,Balık yemekten hoşlanırım.
I like to eat meat.,Et yemeyi severim.
I like to have fun.,Eğlenmeyi severim.
I like to keep fit.,Zinde kalmak hoşuma gidiyor.
I like to think so.,Öyle düşünmeyi seviyorum.
I like to watch TV.,Televizyon izlemeyi severim.
I like video games.,Video oyunlarını seviyorum.
I like watching TV.,Televizyon izlemeyi severim.
I like what I like.,Sevdiğimi seviyorum.
I like windsurfing.,Rüzgar sörfünü severim.
I like your avatar.,Senin avatarını seviyorum.
I like your coffee.,Kahveni severim.
I like your family.,Aileni severim.
I like your garden.,Bahçeni severim.
I like your mirror.,Aynanı seviyorum.
I like your outfit.,Kıyafetini seviyorum.
I liked Tom's idea.,Tom'un fikrini beğendim.
I liked doing that.,Bunu yapmayı sevdim.
I liked that movie.,O film hoşuma gitti.
I liked your story.,Hikayen hoşuma gitti.
I live in Helsinki.,Helsinki'de yaşıyorum.
I live in Kakogawa.,Kakogawa'da yaşıyorum.
I live in Yokohama.,Yokohama'da yaşıyorum.
I live in the city.,Şehirde yaşıyorum.
I live near I work.,Çalıştığım yere yakın yaşıyorum.
I live near a park.,Ben bir parkın yakınında yaşıyorum.
I live next to Tom.,Tom'a bitişik yaşıyorum.
I lived in poverty.,Ben yoksulluk içinde yaşadım.
I long for company.,Arkadaşlık özlemi çekiyorum.
I looked around me.,Etrafıma bakındım.
I looked around me.,Etrafıma baktım.
I looked at my dog.,Ben köpeğime baktım.
I looked for a job.,Bir iş aradım.
I lost my car keys.,Araba anahtarlarımı kaybettim.
I lost my identity.,Kimliğimi kaybettim.
I lost my notebook.,Defterimi kaybettim.
I lost my passport.,Pasaportumu kaybettim.
I lost my patience.,Ben sabrımı kaybettim.
I lost my umbrella.,Benim şemsiyemi kaybettim.
I lost my umbrella.,Şemsiyemi kaybettim.
I lost your number.,Numaranı kaybettim.
I love Irish music.,İrlanda müziğini severim.
I love Korean food.,Kore yemeklerini severim.
I love Mary's hair.,Ben Mary'nin saçını seviyorum.
I love Tom so much.,Tom'u çok seviyorum.
I love Tom's smile.,Tom'un gülümsemesini seviyorum.
I love Tom's voice.,Tom'un sesini severim.
I love a challenge.,Meydan okumayı severim.
I love apple cider.,Elma suyunu severim.
I love apple juice.,Elma suyunu severim.
I love bearded men.,Sakallı erkekleri seviyorum.
I love being alone.,Yalnız olmayı seviyorum.
I love being right.,Haklı olmayı seviyorum.
I love both of you.,Her ikinizi de severim.
I love both of you.,İkinizi de seviyorum.
I love butterflies.,Kelebeklere bayılırım.
I love camping out.,Çadırda yaşamayı severim.
I love comic books.,Çizgi romanları seviyorum.
I love coming here.,Ben buraya gelmeyi seviyorum.
I love fairy tales.,Peri masallarını severim.
I love goat cheese.,Keçi peynirini severim.
I love her perfume.,Onun parfümünü seviyorum.
I love lentil soup.,Mercimek çorbasını severim.
I love my children.,Çocuklarımı seviyorum.
I love our chances.,Şansımızı seviyorum.
I love red parrots.,Kırmızı papağanları seviyorum.
I love summer rain.,Yaz yağmurunu severim.
I love that museum.,O müzeyi seviyorum.
I love that tattoo.,O dövmeyi seviyorum.
I love this device.,Bu cihazı seviyorum.
I love this school.,Bu okulu severim.
I love those shoes.,O ayakkabıları seviyorum.
I love translating.,Çevirmeyi seviyorum.
I love video games.,Ben video oyunlarını seviyorum.
I love watching TV.,Ben televizyon izlemeyi seviyorum.
I love your accent.,Senin aksanını seviyorum.
I love your accent.,Aksanını seviyorum.
I love your garden.,Bahçeni seviyorum.
I love your jacket.,Ceketini seviyorum.
I love your outfit.,Senin kıyafetini seviyorum.
I love your spirit.,Senin ruhunu seviyorum.
I loved every bite.,Her lokmayı severdim.
I loved that house.,O evi sevdim.
I made Mary a doll.,Mary'ye bir bebek yaptım.
I made Tom do that.,Bunu Tom'a yaptırdım.
I made Tom go home.,Tom'u eve gönderdim.
I made a few calls.,Birkaç telefon görüşmesi yaptım.
I made a pot roast.,Bir rosto yaptım.
I made a statement.,Ben bir açıklama yaptım.
I made her a dress.,Ona bir elbise yaptım.
I made it official.,Ben onu resmileştirdim.
I made my decision.,Kararımı verdim.
I made no mistakes.,Hiç hata yapmadım.
I made no promises.,Herhangi bir söz vermedim.
I made other plans.,Başka planlar yaptım.
I made photocopies.,Fotokopi yaptım.
I made tea for Tom.,Tom için çay yaptım.
I made that myself.,Bunu kendim yaptım.
I made them myself.,Ben onları kendim yaptım.
I made this myself.,Bunu kendim yaptım.
I made up with her.,Onunla barıştım.
I made you a snack.,Sana bir aperatif yaptım.
I made you cookies.,Sana kurabiyeler yaptım.
I majored in drama.,Tiyatro sanatında ihtisas yaptım.
I majored in music.,Müzikte ihtisas yaptım.
I make my own luck.,Ben kendi şansımı yaratıyorum.
I manage just fine.,Sadece iyi yönetirim.
I may die tomorrow.,Yarın ölebilirim.
I may do just that.,Sadece onu yapabilirim.
I may just do that.,Ben sadece onu yapabilirim.
I may not be right.,Haklı olmayabilirim.
I may not graduate.,Mezun olamayabilirim.
I mean what I said.,Bu konuda ciddiyim.
I mean you no harm.,Sana zarar vermek niyetinde değilim.
I meant to ask you.,Sana sormak istedim.
I meet her demands.,Onun taleplerini karşılarım.
I met Tom recently.,Geçenlerde Tom'la tanıştım.
I met Tom recently.,Geçenlerde Tom'a rastladım.
I met Tom recently.,Geçenlerde Tom'la bir araya geldim.
I met a nice woman.,Ben güzel bir kadınla tanıştım.
I met an old woman.,Yaşlı bir kadınla tanıştım.
I met him just now.,Onunla az önce tanıştım.
I met him recently.,Geçenlerde onunla tanıştım.
I met my classmate.,Sınıf arkadaşımla karşılaştım.
I might come early.,Ben erken gelebilirim.
I miss Tom already.,Tom'u şimdiden özlüyorum.
I miss Tom so much.,Tom'u çok özlüyorum.
I miss Tom's smile.,Tom'un gülümsemesini özlüyorum.
I miss her so much.,Onu çok özlüyorum.
I miss high school.,Liseyi özlüyorum.
I miss my children.,Çocuklarımı özlüyorum.
I miss you already.,Seni zaten özledim.
I miss you so much.,Seni çok özlüyorum.
I missed my chance.,Fırsatımı kaçırdım.
I missed my flight.,Uçak seferimi kaçırdım.
I missed something.,Ben bir şeyi kaçırdım.
I missed the party.,Partiyi kaçırdım.
I missed the train.,Treni kaçırdım.
I missed you today.,Bugün seni özledim.
I mopped the floor.,Zemini paspas ettim.
I moved last month.,Ben geçen ay taşındım.
I mowed Tom's lawn.,Tom'un çimini biçtim.
I must be dreaming.,Hayal kuruyor olmalıyım.
I must concentrate.,Konsantre olmalıyım.
I must contact Tom.,Tom'la irtibata geçmem gerekiyor.
I must contact Tom.,Tom'la temas kurmalıyım.
I must destroy you.,Seni yok etmeliyim.
I must find my key.,Anahtarımı bulmalıyım.
I must leave early.,Erken ayrılmam gerekiyor.
I must leave early.,Erken ayrılmalıyım.
I must make a call.,Bir çağrı yapmalıyım.
I must talk to Tom.,Tom'la konuşmalıyım.
I must talk to you.,Seninle konuşmalıyım.
I must talk to you.,Seninle konuşmam gerekiyor.
I must talk to you.,Sizinle konuşmalıyım.
I nearly forgot it.,Onu neredeyse unutuyordum.
I need Tom's money.,"Benim, Tom'un parasına ihtiyacım var."
I need a big favor.,Büyük bir iyiliğe ihtiyacım var.
I need a cigarette.,Bir sigaraya ihtiyacım var.
I need a corkscrew.,Bir tirbuşona ihtiyacım var.
I need a corkscrew.,Bana bir tirbuşon lazım.
I need a dry towel.,Kuru bir havluya ihtiyacım var.
I need a hairbrush.,Bana bir saç fırçası gerekiyor.
I need a hairbrush.,Bir saç fırçasına ihtiyacım var.
I need a long rope.,Bana uzun bir ip gerek.
I need a mouse pad.,Bir fare altlığına ihtiyacım var.
I need a new hobby.,Yeni bir hobiye ihtiyacım var.
I need a new phone.,Yeni bir telefona ihtiyacım var.
I need a new shirt.,Yeni bir gömleğe ihtiyacım var.
I need a nurse now.,Şimdi bir hemşireye ihtiyacım var.
I need a ride home.,Eve arabayla gitmek istiyorum.
I need a secretary.,Bir sekretere ihtiyacım var.
I need a volunteer.,Bir gönüllüye ihtiyacım var.
I need an envelope.,Bir zarfa ihtiyacım var.
I need an hour off.,Bir saat izine ihtiyacım var.
I need an umbrella.,Bir şemsiyeye ihtiyacım var.
I need another job.,Başka bir işe ihtiyacım var.
I need another job.,İkinci bir işe ihtiyacım var.
I need another one.,Bir diğerine ihtiyacım var.
I need body lotion.,Vücut losyonuna ihtiyacım var.
I need hand lotion.,El losyonuna ihtiyacım var.
I need information.,Bilgiye ihtiyacım var.
I need inspiration.,İlhama ihtiyacım var.
I need money badly.,Çok fazla paraya ihtiyacım var.
I need more butter.,Daha fazla yağa ihtiyacım var.
I need more coffee.,Daha fazla kahveye ihtiyacım var.
I need my paycheck.,Maaş çekine ihtiyacım var.
I need new glasses.,Yeni gözlüğe ihtiyacım var.
I need solid proof.,Sağlam kanıta ihtiyacım var.
I need some advice.,Biraz nasihata ihtiyacım var.
I need some coffee.,Biraz kahveye ihtiyacım var.
I need some nutmeg.,Bana biraz muskat lazım.
I need some relief.,Biraz rahatlamaya ihtiyacım var.
I need someone now.,Şimdi birinine ihtiyacım var.
"I need stamps, too.",Benim de pullara ihtiyacım var.
I need their names.,Onların isimlerine ihtiyacım var.
I need those files.,Şu dosyalara ihtiyacım var.
I need those shoes.,O ayakkabılara ihtiyacım var.
I need to be alone.,Yalnız kalmaya ihtiyacım var.
I need to be quiet.,Ben sessiz olmalıyım.
I need to buy food.,Benim yiyecek almam gerekiyor.
I need to buy time.,Zaman kazanmam gerekiyor.
I need to call Tom.,Tom'u aramalıyım.
I need to call Tom.,Tom'u aramam gerekiyor.
I need to check it.,Bunu kontrol etmem gerek.
I need to exercise.,Egzersiz yapmam gerekiyor.
I need to feed Tom.,Tom'u beslemeliyim.
I need to find Tom.,Tom'u bulmam gerekiyor.
I need to find her.,Onu bulmalıyım.
I need to find out.,Onu bulmam gerekiyor.
I need to get away.,Kaçmalıyım.
I need to get away.,Sıvışmalıyım.
I need to get home.,Eve gitmeliyim.
I need to get home.,Eve gitmem gerekiyor.
I need to go there.,Oraya gitmem gerekiyor.
I need to help Tom.,Tom'a yardım etmem gerekiyor.
I need to know now.,Şimdi bilmem gerekiyor.
I need to know now.,Şimdi bilmeliyim.
