input_text,target_text
Tom needed training.,Tom'un eğitime ihtiyacı vardı.
Tom needs a haircut.,Tom'un saçını kestirmesi gerekiyor.
Tom needs a new car.,Tom'un yeni bir arabaya ihtiyacı var.
Tom needs attention.,Tom'un ilgiye ihtiyacı var.
Tom needs furniture.,Tom'un mobilyaya ihtiyacı var.
Tom needs his sleep.,Tom'un uykuya ihtiyacı var.
Tom needs more help.,Tom'un daha fazla yardıma ihtiyacı var.
Tom needs more time.,Tom'un biraz daha zamana ihtiyacı var.
Tom needs new shoes.,Tom'un yeni ayakkabılara ihtiyacı var.
Tom needs our input.,Tom'un bizim girdimize ihtiyacı var.
Tom needs some cash.,Tom'un biraz paraya ihtiyacı var.
Tom needs some cash.,Tom'un biraz nakite ihtiyacı var.
Tom needs some help.,Tom'un biraz yardıma ihtiyacı var.
Tom needs some love.,Tom'un biraz sevgiye ihtiyacı var.
Tom needs some rest.,Tom'un biraz dinlenmeye ihtiyacı var.
Tom needs some time.,Tom'un biraz zamana ihtiyacı vardı.
Tom needs something.,Tom'un bir şeye ihtiyacı var.
Tom needs the money.,Tom'un paraya ihtiyacı var.
Tom needs the truth.,Tom'un gerçeğe ihtiyacı var.
Tom needs to resign.,Tom istifa etmeye ihtiyaç duyar.
Tom needs to retire.,Tom'un emekli olması gerekiyor.
Tom needs treatment.,Tom'un tedaviye ihtiyacı var.
Tom needs your help.,Tom'un senin yardımına ihtiyacı var.
Tom needs your help.,Tom'un sizin yardımınıza ihtiyacı var.
Tom needs your love.,Tom'un senin sevgine ihtiyacı var.
Tom never asked why.,Tom asla sebebini sormadı.
Tom never called me.,Tom beni hiç aramadı.
Tom never came back.,Tom asla geri dönmedi.
Tom never came home.,Tom eve hiç gelmedi.
Tom never came over.,Tom asla uğramadı.
Tom never complains.,Tom asla şikâyet etmez.
Tom never confessed.,Tom asla itiraf etmedi.
Tom never does that.,Tom onu asla yapmaz.
Tom never eats pork.,Tom asla domuz yemez.
Tom never exercises.,Tom asla egzersiz yapmaz.
Tom never felt fear.,Tom asla korkmadı.
Tom never fooled me.,Tom asla beni aptal yerine koymadı.
Tom never gets lost.,Tom asla kaybolmaz.
Tom never gets sick.,Tom hiç hasta olmaz.
Tom never got drunk.,Tom asla sarhoş olmadı.
Tom never hesitated.,Tom asla çekinmedi.
Tom never hurt Mary.,Tom Mary'ye hiç zarar vermedi.
Tom never knew Mary.,"Tom, Mary'yi hiç tanımıyordu."
Tom never knew that.,Tom onu asla bilmiyordu.
Tom never lost hope.,Tom umudunu hiç kaybetmedi.
Tom never loved you.,Tom asla seni sevmedi.
Tom never recovered.,Tom asla iyileşmedi.
Tom never remarried.,Tom asla yeniden evlenmedi.
Tom never responded.,Tom asla cevap vermedi.
Tom never said that.,Tom asla onu söylemedi.
Tom never showed up.,Tom hiç gelmedi.
Tom never was fussy.,Tom hiç telaşlı değildi.
Tom never wears red.,Tom asla kırmızı giymez.
Tom never went back.,Tom hiç geri dönmedi.
Tom nodded and left.,Tom başını salladı ve gitti.
Tom nodded approval.,Tom onaylamak için başını salladı.
Tom nodded his head.,Tom başını salladı.
Tom nodded politely.,Tom kibarca başını salladı.
Tom nodded silently.,Tom sessizce başını salladı.
Tom nodded slightly.,Tom hafifçe başını salladı.
Tom now wears a wig.,Tom şimdi bir peruk takıyor.
Tom offered to help.,Tom yardım teklif etti.
Tom often came here.,Tom sık sık buraya geldi.
Tom often does that.,Tom sıklıkla bunu yapar.
Tom often gets sick.,Tom sık sık hasta olur.
Tom often helped us.,Tom sık sık bize yardım etti.
Tom often said that.,Tom sık sık bunu söyledi.
Tom often says that.,Tom onu sık sık söyler.
Tom often visits me.,Tom sık sık beni ziyaret eder.
Tom opened a window.,Tom bir pencere açtı.
Tom opened his book.,Tom kitabını açtı.
Tom opened his eyes.,Tom gözlerini açtı.
Tom opened the beer.,Tom birayı açtı.
Tom opened the book.,Tom kitabı açtı.
Tom opened the door.,Tom kapıyı açtı.
Tom opened the gate.,Tom kapıyı açtı.
Tom opened the hood.,Tom başlığı açtı.
Tom opened the safe.,Tom kasayı açtı.
Tom ordered a drink.,Tom bir içki ısmarladı.
Tom ordered a pizza.,Tom pizza sipariş etti.
Tom ordered a steak.,Tom bir biftek sipariş etti.
Tom outsmarted Mary.,Tom Mary'yi zekası ile altetti.
Tom owed Mary money.,Tom Mary'ye para borçluydu.
Tom owes Mary a lot.,Tom Mary'ye çok şey borçludur.
Tom owes Mary money.,Tom'un Mary'ye borcu var.
Tom owes me a favor.,Tom bana bir iyilik borçlu.
Tom owes us a favor.,Tom bize bir iyilik borçlu.
Tom owns a blue car.,Tom'un mavi bir arabası var.
Tom owns a business.,Tom bir iş sahibi.
Tom owns this place.,Bu yerin sahibi Tom'dur.
Tom packed his bags.,Tom çantalarını düzenledi.
Tom paid for dinner.,Tom akşam yemeği için ödedi.
Tom paid for it all.,Tom hepsi için ödedi.
Tom paid me a visit.,Tom beni ziyaret etti.
Tom passed the exam.,Tom sınavı geçti.
Tom passed the test.,Tom testi geçti.
Tom paused a moment.,Tom bir an durakladı.
Tom paused a second.,Tom bir saniye durakladı.
Tom peeled an apple.,Tom bir elma soydu.
Tom picked the lock.,Tom kilidi sivri bir şeyle açtı.
Tom picked the song.,Tom şarkıyı seçti.
Tom plans to return.,Tom dönmeyi planlıyor.
Tom played football.,Tom futbol oynadı.
Tom plays in a band.,Tom bir grupta çalıyor.
Tom plays the drums.,Tom davul çalar.
Tom plays the drums.,Tom bateri çalar.
Tom plays the flute.,Tom flüt çalıyor.
Tom plays the piano.,Tom piyano çalar.
Tom pointed at Mary.,Tom Mary'yi gösterdi.
Tom pointed to Mary.,Tom Mary'yi gösterdi.
Tom prefers blondes.,Tom sarışınları tercih eder.
Tom promptly obeyed.,Tom derhal itaat etti.
Tom pruned the tree.,Tom ağacı budadı.
Tom pulled a muscle.,Tom bir kasını incitti.
Tom pulled the rope.,Tom ipi çekti.
Tom purchased a wig.,Tom bir peruk aldı.
Tom pursed his lips.,Tom dudaklarını büzdü.
Tom put his hand up.,Tom elini kaldırdı.
Tom put on an apron.,Tom bir önlük giydi.
Tom put on his coat.,Tom paltosunu giydi.
Tom put on his robe.,Tom cüppesini giydi.
Tom put on my shirt.,Tom benim gömleğimi giydi.
Tom questioned Mary.,Tom Mary'yi sorguladı.
Tom quit doing that.,Tom bunu yapmayı bıraktı.
Tom raised his arms.,Tom kollarını kaldırdı.
Tom raised his hand.,Tom elini kaldırdı.
Tom raised the flag.,Tom bayrağı çekti.
Tom ran a good race.,Tom iyi bir yarış çıkardı.
Tom ran a red light.,Tom kırmızı ışıkta geçti.
Tom ran back inside.,Tom içeri koştu.
Tom ran out of food.,Tom'un yiyeceği tükendi.
Tom ran out of time.,Tom'un zamanı bitti.
Tom ran three miles.,Tom üç mil koştu.
Tom ran to the door.,Tom kapıya koştu.
Tom ran up the hill.,Tom tepeye koştu.
Tom rarely goes out.,Tom nadiren dışarı gider.
Tom reacted angrily.,Tom öfkeyle tepki gösterdi.
Tom reacted quickly.,Tom hızla tepki gösterdi.
Tom really did that.,Tom gerçekten bunu yaptı.
Tom really likes it.,Tom gerçekten onu seviyor.
Tom really meant it.,Tom gerçekten bunu demek istedi.
Tom really wants it.,Tom gerçekten onu istiyor.
Tom recognized Mary.,Tom Mary'yi tanıdı.
Tom refused to help.,Tom yardım etmeyi kabul etmedi.
Tom refused to move.,Tom taşınmayı reddetti.
Tom refused to sing.,Tom şarkı söylemeyi reddetti.
Tom refused to talk.,Tom konuşmayı reddetti.
Tom refuses to sing.,Tom şarkı söylemeyi reddediyor.
Tom refuses to talk.,Tom konuşmayı reddediyor.
Tom refuses to work.,Tom çalışmayı reddediyor.
Tom regretted lying.,Tom yalan söylediğine pişman oldu.
Tom remained behind.,Tom geride kaldı.
Tom remained seated.,Tom oturmuş kaldı.
Tom remained seated.,Tom oturmaya devam etti.
Tom remained silent.,Tom sessiz kaldı.
Tom remains defiant.,Tom muhalif kalmaktadır.
Tom remains in jail.,Tom hapiste kalıyor.
Tom remains puzzled.,Tom şaşkın kalıyor.
Tom remains puzzled.,Tom'un şaşkınlığı devam ediyor.
Tom reserved a seat.,Tom bir koltuk ayırdı.
Tom resumed reading.,Tom okumaya devam etti.
Tom resumed walking.,Tom yürüyüşe devam etti.
Tom retired in 2013.,Tom 2013 yılında emekli oldu.
Tom rides a bicycle.,Tom bisiklet sürüyor.
Tom rides a scooter.,Tom bir scooter kullanıyor.
Tom rolled his eyes.,Tom inanmadığını gözleriyle ifade etti.
Tom rolled the dice.,Tom zarı yuvarladı.
Tom rubbed his chin.,Tom çenesini ovuşturdu.
Tom rubbed his eyes.,Tom gözlerini ovuşturdu.
Tom rubbed his face.,Tom yüzünü ovuşturdu.
Tom rushed upstairs.,Tom yukarı koştu.
Tom said I did that.,Tom onu yaptığımı söyledi.
Tom said I was cute.,Tom sevimli olduğumu söyledi.
Tom said I was lazy.,Tom tembel olduğumu söyledi.
Tom said I was rude.,Tom benim kaba olduğumu söyledi.
Tom said I was ugly.,Tom çirkin olduğunu söyledi.
Tom said he'd leave.,Tom ayrılacağını söyledi.
Tom said he'll sing.,Tom şarkı söyleyeceğini söyledi.
Tom said he'll wait.,Tom bana bekleyeceğini söyledi.
Tom said he's alone.,Tom bana yalnız olduğunu söyledi.
Tom said he's bored.,Tom sıkıldığını söyledi.
Tom said he's broke.,Tom meteliksiz olduğunu söyledi.
Tom said he's drunk.,Tom sarhoş olduğunu söyledi.
Tom said he's ready.,Tom hazır olduğunu söyledi.
Tom said he's tired.,Tom yorgun olduğunu söyledi.
Tom said he's upset.,Tom üzüntülü olduğunu söyledi.
Tom said it was bad.,Tom onun kötü olduğunu söyledi.
Tom said it was fun.,Tom bunun eğlenceli olduğunu söyledi.
Tom said this to me.,Bunu bana Tom söyledi.
Tom said to ask you.,Tom sana sormamı söyledi.
Tom said you'd come.,Tom geleceğini söyledi.
Tom said you'd know.,Tom bileceğini söyledi.
Tom sang and danced.,Tom şarkı söyledi ve dans etti.
Tom sat at his desk.,Tom masasında oturdu.
Tom sat beside Mary.,Tom Mary'nin yanına oturdu.
Tom sat facing Mary.,Tom Mary ile yüz yüze oturdu.
Tom sat impatiently.,Tom sabırsızlıkla oturdu.
Tom sat in the back.,Tom arkada oturdu.
Tom sat on the curb.,Kaldırımın kenarına oturdu.
Tom sat on the sofa.,Tom kanepede oturdu.
Tom sat watching TV.,Tom TV izlerken oturdu.
Tom saved all of us.,Tom hepimizi kurtardı.
Tom saved everybody.,Tom herkesi kurtardı.
Tom saved our lives.,Tom hayatlarımızı kurtardı.
Tom saved your life.,Tom yaşamını kurtardı.
Tom saw Mary coming.,Tom Mary'nin geldiğini gördü.
Tom saw Mary crying.,Tom Mary'nin ağladığını gördü.
Tom saw you do that.,Tom bunu yaptığını gördü.
Tom says I'm stingy.,Tom cimri olduğumu söylüyor.
Tom says he is rich.,Tom zengin olduğunu söylüyor.
Tom says he is rich.,Tom onun zengin olduğunu söylüyor.
Tom says he'll come.,Tom geleceğini söylüyor.
Tom says he'll sing.,Tom şarkı söyleyeceğini söylüyor.
Tom says he'll swim.,Tom yüzeceğini söylüyor.
Tom says he'll wait.,Tom bekleyeceğini söylüyor.
Tom says he's angry.,Tom kızgın olduğunu söylüyor.
Tom says he's dying.,Tom öldüğünü söylüyor.
Tom says he's happy.,Tom mutlu olduğunu söylüyor.
Tom says he's tired.,Tom yorgun olduğunu söylüyor.
Tom scalded his arm.,Tom kolunu yaktı.
Tom scowled at Mary.,Tom Mary'ye kaşlarını çattı.
Tom screamed loudly.,Tom yüksek sesle çığlık attı.
Tom sealed the deal.,Tom anlaşmayı mühürledi.
Tom sealed the room.,Tom odayı mühürledi.
Tom seemed agitated.,Tom üzgün görünüyordu.
Tom seemed arrogant.,Tom kibirli görünüyordu.
Tom seemed artistic.,Tom artistik görünüyordu.
Tom seemed cheerful.,Tom neşeli görünüyordu.
Tom seemed confused.,Tom'un kafası karışmış görünüyordu.
Tom seemed friendly.,Tom samimi görünüyordu.
Tom seemed gullible.,Tom saf görünüyordu.
Tom seemed harmless.,Tom zararsız görünüyordu.
Tom seemed hesitant.,Tom kararsız görünüyordu.
Tom seemed insecure.,Tom güvensiz görünüyordu.
Tom seemed offended.,Tom kırgın görünüyordu.
Tom seemed positive.,Tom olumlu görünüyordu.
Tom seemed prepared.,Tom hazırlıklı görünüyordu.
Tom seemed reliable.,Tom güvenilir görünüyordu.
Tom seemed relieved.,Tom rahatlamış görünüyordu.
Tom seemed so happy.,Tom çok mutlu görünüyordu.
Tom seemed stressed.,Tom stresli görünüyordu.
Tom seemed to agree.,Tom kabul ediyor gibi görünüyordu.
Tom seemed to be OK.,Tom iyi görünüyordu.
Tom seemed troubled.,Tom rahatsız edilmiş görünüyordu.
Tom seemed very sad.,Tom çok üzgün görünüyordu.
Tom seems ambitious.,Tom hırslı görünüyor.
Tom seems assertive.,Tom iddialı görünüyor.
Tom seems attentive.,Tom özenli görünüyor.
Tom seems competent.,Tom yetenekli görünüyor.
Tom seems conceited.,Tom kibirli görünüyor.
Tom seems confident.,Tom emin görünüyor.
Tom seems contented.,Tom memnun görünüyor.
Tom seems courteous.,Tom kibar görünüyor.
Tom seems dangerous.,Tom tehlikeli görünüyor.
Tom seems depressed.,Tom bunalımlı görünüyor.
Tom seems desperate.,Tom umutsuz görünüyor.
Tom seems disturbed.,Tom rahatsız edilmiş görünüyor.
Tom seems easygoing.,Tom babacan görünüyor.
Tom seems efficient.,Tom verimli görünüyor.
Tom seems flustered.,Tom telaşlı görünüyor.
Tom seems impatient.,Tom sabırsız görünüyor.
Tom seems impressed.,Tom etkilenmiş görünüyor.
Tom seems insincere.,Tom samimiyetsiz görünüyor.
Tom seems irritated.,Tom öfkeli görünüyor.
Tom seems motivated.,Tom motive görünüyor.
Tom seems objective.,Tom objektif görünüyor.
Tom seems oblivious.,Tom habersiz görünüyor.
Tom seems perplexed.,Tom şaşkın görünüyor.
Tom seems reluctant.,Tom isteksiz görünüyor.
Tom seems satisfied.,Tom hoşnut görünüyor.
Tom seems secretive.,Tom ağzı sıkı görünüyor.
Tom seems skeptical.,Tom şüpheci görünüyor.
Tom seems so lonely.,Tom çok yalnız görünüyor.
Tom seems surprised.,Tom şaşırmış görünüyor.
Tom seems to be sad.,Tom üzgün görünüyor.
Tom seems to be shy.,Tom utangaç görünüyor.
Tom seems very busy.,Tom çok meşgul görünüyor.
Tom seems very calm.,Tom çok sakin görünüyor.
Tom seems very nice.,Tom çok hoş görünüyor.
Tom seldom goes out.,Tom nadiren dışarı gider.
Tom sells computers.,Tom bilgisayar satar.
Tom served one term.,Tom bir dönem hizmet etti.
Tom set this record.,Tom bu rekoru kırdı.
Tom shaved his head.,Tom başını tıraş etti.
Tom shot Mary's dog.,Tom Mary'nin köpeğini vurdu.
Tom should be alone.,Tom yalnız olmalı.
Tom should be angry.,Tom'un öfkeli olması gerekir.
Tom should be early.,Tom erken gelmeli.
Tom should be fired.,Tom kovulmalı.
Tom should be first.,Tom birinci olmalı.
Tom should be happy.,Tom mutlu olmalı.
Tom should be proud.,Tom gurur duymalı.
Tom should be ready.,Tom hazır olmalı.
Tom should be there.,Tom orada olmalı.
Tom should be upset.,Tom üzgün olmalı.
Tom should thank me.,Tom bana teşekkür etmeli.
Tom should've asked.,Tom sormalıydı.
Tom should've known.,Tom bilmeliydi.
Tom shouldn't drink.,Tom içki içmemeli.
Tom shouted at Mary.,"Tom, Mary'ye bağırdı."
Tom shouted to Mary.,Tom Mary'ye bağırdı.
Tom showed it to me.,Tom onu bana gösterdi.
Tom shut his laptop.,Tom dizüstü bilgisayarını kapattı.
Tom shut the TV off.,Tom televizyonu kapattı.
Tom shut the blinds.,Tom panjuru kapattı.
Tom shut the drawer.,Tom çekmeceyi kapattı.
Tom shut the window.,Tom pencereyi kapattı.
Tom sided with Mary.,Tom Mary ile aynı tarafta oldu.
Tom sided with Mary.,Tom Mary'nin tarafını tuttu.
Tom signed a pledge.,Tom içkiyi bırakacağına söz verdi.
Tom signed a pledge.,Tom içkiye tövbe etti.
Tom signed a prenup.,Tom bir evlilik sözleşmesi imzaladı.
Tom signed a waiver.,Tom bir feregat imzaladı.
Tom signed his name.,Tom adını imzaladı.
Tom signed the bill.,Tom tasarıyı imzaladı.
Tom sings at church.,Tom kilisede şarkı söyler.
Tom sings very well.,Tom çok iyi şarkı söyler.
Tom sipped his wine.,Tom şarabını yudumladı.
Tom sipped some tea.,Tom biraz çay yudumladı.
Tom sits over there.,Tom orada oturuyor.
Tom skipped a grade.,Tom bir sınıfı atladı.
Tom sleeps on a cot.,Tom bir çocuk karyolasında uyur.
Tom slept till dawn.,Tom sabaha kadar uyudu.
Tom slit his wrists.,Tom bileklerini kesti.
Tom smells horrible.,Tom korkunç kokuyor.
Tom smiled guiltily.,Tom suçlu bir biçimde gülümsedi.
Tom smiled inwardly.,Tom içten gülümsedi.
Tom smiled politely.,Tom kibarca gülümsedi.
Tom smiled slightly.,Tom hafifçe gülümsedi.
Tom sobbed out loud.,Tom yüksek sesle hıçkırarak anlattı.
Tom sorted the mail.,Tom postayı sınıflandırdı.
Tom sounded excited.,Tom heyecanlı görünüyordu.
Tom sounded worried.,Tom endişeli görünüyordu.
Tom sounds agitated.,Tom heyecanlı görünüyor.
Tom sounds horrible.,Tom harika görünüyor.
Tom speaks too fast.,Tom çok hızlı konuşur.
Tom spoke in French.,Tom Fransızca konuştu.
Tom spoke the truth.,Tom gerçeği konuştu.
Tom spoke very well.,Tom çok iyi konuştu.
Tom stared intently.,Tom dikkatle baktı.
Tom started dancing.,Tom dans etmeye başladı.
Tom started digging.,Tom araştırmaya başladı.
Tom started driving.,Tom araba sürmeye başladı.
Tom started leaving.,Tom gitmeye başladı.
Tom started packing.,Tom paketlemeye başladı.
Tom started playing.,Tom oynamaya başladı.
Tom started reading.,Tom okumaya başladı.
Tom started running.,Tom koşmaya başladı.
Tom started shaking.,Tom sallanmaya başladı.
Tom started singing.,Tom şarkı söylemeye başladı.
Tom started smiling.,Tom gülümsemeye başladı.
Tom started snoring.,Tom horlamaya başladı.
Tom started sobbing.,Tom hıçkırarak ağlamaya başladı.
Tom started talking.,Tom konuşmaya başladı.
Tom started the car.,Tom arabayı çalıştırdı.
Tom started to sing.,Tom şarkı söylemeye başladı.
Tom started walking.,Tom yürümeye başladı.
Tom started whining.,Tom sızlanmaya başladı.
Tom started working.,Tom çalışmaya başladı.
Tom started writing.,Tom yazmaya başladı.
Tom started yelling.,Tom bağırmaya başladı.
Tom stayed positive.,Tom pozitif kaldı.
Tom stayed upstairs.,Tom üst katta kaldı.
Tom stepped forward.,Tom öne çıktı.
Tom stepped outside.,Tom dışarı çıktı.
Tom stifled a groan.,Tom bir inilti bastırdı.
Tom stifled a laugh.,Tom bir kahkaha bastırdı.
Tom still disagrees.,Tom hâlâ katılmıyor.
Tom still does that.,Tom hâlâ bunu yapıyor.
Tom still might cry.,Tom hâlâ ağlayabilir.
Tom still might die.,Tom hâlâ ölebilir.
Tom still might win.,Tom hâlâ kazanabilir.
Tom still scares me.,Tom hâlâ beni korkutur.
Tom stirred his tea.,Tom çayını karıştırdı.
Tom stole my camera.,Tom benim kameramı çaldı.
Tom stole my wallet.,Tom cüzdanımı çaldı.
Tom stole the money.,Tom parayı çaldı.
Tom stole your bike.,Tom senin bisikletini çaldı.
Tom stole your ring.,Tom yüzüğünü çaldı.
Tom stole your ring.,Tom senin yüzüğünü çaldı.
Tom stole your ring.,Tom yüzüğünüzü çaldı.
Tom stole your ring.,Tom sizin yüzüğünüzü çaldı.
Tom stood behind me.,Tom arkamda durdu.
Tom stood near Mary.,Tom Mary'nin yanında durdu.
Tom stood up slowly.,Tom yavaşça ayağa kalktı.
Tom stopped arguing.,Tom tartışmayı durdurdu.
Tom stopped dancing.,Tom dans etmeyi durdurdu.
Tom stopped digging.,Tom kazmayı durdurdu.
Tom stopped himself.,Tom kendi durdurdu.
Tom stopped playing.,Tom oynamayı durdurdu.
Tom stopped reading.,Tom okumayı durdurdu.
Tom stopped running.,Tom koşmayı durdurdu.
Tom stopped shaving.,Tom tıraş olmayı durdurdu.
Tom stopped singing.,Tom şarkı söylemeyi durdurdu.
Tom stopped smiling.,Tom gülümsemeyi durdurdu.
Tom stopped talking.,Tom konuşmayı kesti.
Tom stopped the car.,Tom arabayı durdurdu.
Tom stopped to talk.,Tom konuşmayı durdurdu.
Tom stopped walking.,Tom yürümeyi durdurdu.
Tom stopped working.,Tom çalışmayı durdurdu.
Tom stopped writing.,Tom yazı yazmayı durdurdu.
Tom stubbed his toe.,Tom ayak parmağını çarptı.
Tom stuck up for me.,Tom beni savundu.
Tom swears too much.,Tom çok küfrediyor.
Tom swept the floor.,Tom zemini süpürdü.
Tom swims every day.,Tom her gün yüzer.
Tom swims very fast.,Tom çok hızlı yüzer.
Tom swims very well.,Tom çok iyi yüzer.
Tom swore he'd wait.,Tom bekleyeceğine yemin etti.
Tom talked too much.,Tom çok fazla konuştu.
Tom talks very fast.,Tom çok hızlı konuşur.
Tom tasted the cake.,Tom kekin tadına baktı.
Tom tasted the stew.,Tom güvecin tadına baktı.
Tom tasted the wine.,Tom şarabı tattı.
Tom taught me a lot.,Tom bana çok şey öğretti.
Tom taught us a lot.,Tom bize çok şey öğretti.
Tom taught us music.,Tom bize müzik öğretti.
Tom teaches history.,Tom tarih öğretiyor.
Tom teaches history.,Tom tarih dersi veriyor.
Tom teaches history.,Tom tarih öğretmenliği yapıyor.
Tom tensed slightly.,Tom hafifçe gerildi.
Tom texted a friend.,Tom bir arkadaşına mesaj gönderdi.
Tom thinks Mary won.,Tom Mary'nin kazandığını düşünüyor.
Tom thought it over.,Tom onun üzerinde düşünüp taşındı.
"Tom thought so, too.",Tom da öyle düşünmüştü.
Tom threatened Mary.,Tom Mary'yi tehdit etti.
Tom threatened them.,Tom onları tehdit etti.
Tom tilted his head.,Tom başını eğdi.
Tom told me a story.,Tom bana bir hikaye anlattı.
Tom told me nothing.,Tom bana hiçbir şey söylemedi.
Tom told me to stay.,Tom kalmamı söyledi.
Tom told me to swim.,Tom yüzmemi söyledi.
Tom told me to wait.,Tom beklememi söyledi.
Tom told me you won.,Tom bana kazandığını söyledi.
Tom told us a story.,Tom bize bir hikaye anlattı.
Tom told us to wait.,Tom bize beklememizi söyledi.
Tom took Friday off.,Tom cuma günü izin aldı.
Tom took Mary along.,Tom Mary'yi yanında götürdü.
Tom took a bad fall.,Tom kötü şekilde düştü.
Tom took a big risk.,Tom büyük bir risk aldı.
Tom took a hard hit.,Tom sert bir darbe aldı.
Tom took a week off.,Tom bir hafta izne çıktı.
Tom took an aspirin.,Tom bir aspirin aldı.
Tom took care of us.,Tom bize baktı.
Tom took everything.,Tom her şeyi aldı.
Tom took my picture.,Tom benim resmimi çekti.
Tom took this photo.,Tom bu fotoğrafı çekti.
Tom tossed the ball.,Tom topu attı.
Tom totaled his car.,Tom arabasını parçaladı.
Tom touched my hand.,Tom elime dokundu.
Tom tried a coat on.,Tom bir ceket denedi.
Tom tried to escape.,Tom kaçmaya çalıştı.
Tom tried to hit me.,Tom bana vurmaya çalıştı.
Tom tried to resist.,Tom direnmeye çalıştı.
Tom tried to sit up.,Tom dik oturmaya çalıştı.
Tom turned the knob.,Tom topuzu dönderdi.
Tom turned the page.,Tom sayfayı çevirdi.
Tom turned to leave.,Tom terk etmek için döndü.
Tom understood Mary.,Tom Mary'yi anladı.
Tom understood that.,Tom onu anladı.
Tom used to be lazy.,Tom tembeldi.
Tom used to be mean.,Tom cimriydi.
Tom used to be neat.,Tom düzenliydi.
Tom used to be nice.,Tom hoştu.
Tom used to be poor.,Tom fakirdi.
Tom used to be rich.,Tom zengindi.
Tom used to be thin.,Tom zayıftı.
Tom used to be ugly.,Tom çirkindi.
Tom used to do that.,Tom onu yapardı.
Tom waited a moment.,Tom bir an bekledi.
Tom waited for Mary.,Tom Mary'yi bekledi.
Tom waited his turn.,Tom sırasını bekledi.
Tom walked upstairs.,Tom üst kata çıktı.
Tom walks to school.,Tom okula yürüyerek gider.
Tom wanted sympathy.,Tom sempati istedi.
Tom wanted to dance.,Tom dans etmek istedi.
Tom wanted to do it.,Tom bunu yapmak istedi.
Tom wanted to fight.,Tom mücadele etmek istedi.
Tom wanted to learn.,Tom öğrenmek istedi.
Tom wanted to leave.,Tom ayrılmak istiyordu.
Tom wanted to pitch.,Tom kur yapmak istiyordu.
Tom wanted to relax.,Tom dinlenmek istiyordu.
Tom wanted to speak.,Tom konuşmak istiyordu.
Tom wanted to watch.,Tom izlemek istedi.
Tom wants Mary back.,Tom Mary'yi geri istiyor.
Tom wants a bicycle.,Tom bir bisiklet istiyor.
Tom wants a divorce.,Tom boşanmak istiyor.
Tom wants a new car.,Tom yeni bir araba istiyor.
Tom wants a new hat.,Tom yeni bir şapka istiyor.
Tom wants a rematch.,Tom bir rövanş istiyor.
Tom wants attention.,Tom ilgi istiyor.
Tom wants it so bad.,Tom bunu çok istiyor.
Tom wants much more.,Tom çok daha fazla istiyor.
Tom wants some milk.,Tom biraz süt istiyor.
Tom wants some more.,Tom biraz daha istiyor.
Tom wants to change.,Tom değişmek istiyor.
Tom wants to escape.,Tom kaçmak istiyor.
Tom wants to retire.,Tom emekli olmak istiyor.
Tom wants to see it.,Tom onu görmek istiyor.
Tom wants to see me.,Tom beni görmek istiyor.
Tom wants to see us.,Tom bizi görmek istiyor.
Tom wants to try it.,Tom onu denemek istiyor.
Tom wants vengeance.,Tom intikam istiyor.
Tom wants you badly.,Tom seni kötü bir şekilde istiyor.
Tom wants you fired.,Tom senin kovulmanı istiyor.
Tom was a bartender.,Tom bir barmendi.
Tom was a bit drunk.,Tom biraz sarhoştu.
Tom was a bit early.,Tom biraz erken geldi.
Tom was a bit woozy.,Tom biraz sarhoştu.
Tom was a boy scout.,Tom bir erkek izciydi.
Tom was a brave man.,Tom cesur bir erkekti.
Tom was a carpenter.,Tom bir marangozdu.
Tom was a cruel man.,Tom zalim bir adamdı.
Tom was a gentleman.,Tom bir beyefendi idi.
Tom was a gentleman.,Tom bir centilmendi.
Tom was a go-getter.,Tom azimli bir kişiydi.
Tom was a go-getter.,Tom tuttuğunu koparan bir kişiydi.
Tom was a good cook.,Tom iyi bir aşçıydı.
Tom was a great guy.,Tom harika bir adamdı.
Tom was a mercenary.,Tom paralı askerdi.
Tom was a real hero.,Tom gerçek bir kahramandı.
Tom was a rough man.,Tom kaba bir adamdı.
Tom was a terrorist.,Tom bir teröristti.
Tom was adventurous.,Tom maceraperestti.
Tom was alone there.,Tom orada yalnızdı.
Tom was also killed.,Tom da öldürüldü.
Tom was always busy.,Tom her zaman meşguldü.
Tom was always fair.,Tom her zaman adildi.
Tom was always kind.,Tom her zaman nazikti.
Tom was an attorney.,Tom bir avukattı.
Tom was an imbecile.,Tom bir embesildi.
Tom was an outsider.,Tom bir yabancıydı.
Tom was at the game.,Tom oyundaydı.
Tom was being quiet.,Tom sakin davranıyordu.
Tom was belligerent.,Tom kavgacıydı.
Tom was blacklisted.,Tom kara listeye alınmıştı.
Tom was blindfolded.,Tom'un gözleri bağlıydı.
Tom was called away.,Tom çağrıldı.
Tom was celebrating.,Tom kutluyordu.
Tom was competitive.,Tom rekabetçiydi.
Tom was complaining.,Tom şikâyet ediyordu.
Tom was considerate.,Tom düşünceliydi.
